  1 2018-02-09 08:59:07.198172    10.10.1.1 -> 10.10.2.1    TCP 47302→80 [ACK] Seq=1394080085 Ack=3266262189 Win=17520[Malformed Packet] 90:e2:ba:82:2c:7d -> 90:e2:ba:3e:a6:e8
  2 2018-02-09 08:59:07.202945    10.10.1.1 -> 10.10.2.1    TCP 8266→80 [FIN, ACK] Seq=1003409482 Ack=2273879807 Win=17520[Malformed Packet] 90:e2:ba:82:2c:7d -> 90:e2:ba:3e:a6:e8
  3 2018-02-09 08:59:07.207508    10.10.1.1 -> 10.10.2.1    TCP 2082→1214 [ACK] Seq=1 Ack=1 Win=17188 Len=6 90:e2:ba:82:2c:7d -> 90:e2:ba:3e:a6:e8
  4 2018-02-09 08:59:07.211693    10.10.1.1 -> 10.10.2.1    TCP 10646→1469 [PSH, ACK] Seq=1 Ack=1 Win=9660 Len=6 90:e2:ba:82:2c:7d -> 90:e2:ba:3e:a6:e8
  5 2018-02-09 08:59:07.215979    10.10.1.1 -> 10.10.2.1    TCP 80→2436 [ACK] Seq=1 Ack=1 Win=8460 Len=0 90:e2:ba:82:2c:7d -> 90:e2:ba:3e:a6:e8
  6 2018-02-09 08:59:07.216087    10.10.2.1 -> 10.10.1.1    TCP 2436→80 [RST] Seq=1 Win=0 Len=0 90:e2:ba:3e:a6:e8 -> 90:e2:ba:82:2c:7d
  7 2018-02-09 08:59:07.220059    10.10.1.1 -> 10.10.2.1    TCP [TCP segment of a reassembled PDU] 90:e2:ba:82:2c:7d -> 90:e2:ba:3e:a6:e8
  8 2018-02-09 08:59:07.224135    10.10.1.1 -> 10.10.2.1    TCP [TCP Retransmission] 10646→1469 [ACK] Seq=4294965917 Ack=1 Win=9660 Len=6 90:e2:ba:82:2c:7d -> 90:e2:ba:3e:a6:e8
  9 2018-02-09 08:59:07.227965    10.10.1.1 -> 10.10.2.1    TCP 3988→80 [ACK] Seq=1 Ack=1 Win=8760 Len=0 90:e2:ba:82:2c:7d -> 90:e2:ba:3e:a6:e8
 10 2018-02-09 08:59:07.228068    10.10.2.1 -> 10.10.1.1    TCP 80→3988 [RST] Seq=1 Win=0 Len=0 90:e2:ba:3e:a6:e8 -> 90:e2:ba:82:2c:7d
 11 2018-02-09 08:59:07.231520    10.10.1.1 -> 10.10.2.1    TCP 80→46181 [PSH, ACK] Seq=1 Ack=1 Win=31504 Len=6 90:e2:ba:82:2c:7d -> 90:e2:ba:3e:a6:e8
 12 2018-02-09 08:59:07.233520    10.10.1.1 -> 10.10.2.1    TCP 9949→80 [PSH, ACK] Seq=2201617779 Ack=3464876108 Win=17520[Malformed Packet] 90:e2:ba:82:2c:7d -> 90:e2:ba:3e:a6:e8
 13 2018-02-09 08:59:07.235684    10.10.1.1 -> 10.10.2.1    TCP 80→1570 [SYN, ACK] Seq=3124942518 Ack=3829827209 Win=17520 MSS=1460 90:e2:ba:82:2c:7d -> 90:e2:ba:3e:a6:e8
 14 2018-02-09 08:59:07.237901    10.10.1.1 -> 10.10.2.1    TCP 10322→1373 [ACK] Seq=1 Ack=1 Win=9898 Len=6 90:e2:ba:82:2c:7d -> 90:e2:ba:3e:a6:e8
 15 2018-02-09 08:59:07.240182    10.10.1.1 -> 10.10.2.1    TCP 2671→8080 [ACK] Seq=1 Ack=1 Win=8760 Len=0 90:e2:ba:82:2c:7d -> 90:e2:ba:3e:a6:e8
 16 2018-02-09 08:59:07.240269    10.10.2.1 -> 10.10.1.1    TCP 8080→2671 [RST] Seq=1 Win=0 Len=0 90:e2:ba:3e:a6:e8 -> 90:e2:ba:82:2c:7d
 17 2018-02-09 08:59:07.242376    10.10.1.1 -> 10.10.2.1    TCP [TCP segment of a reassembled PDU] 90:e2:ba:82:2c:7d -> 90:e2:ba:3e:a6:e8
 18 2018-02-09 08:59:07.244750    10.10.1.1 -> 10.10.2.1    TCP 51254→80 [ACK] Seq=1 Ack=1 Win=32120 Len=0 90:e2:ba:82:2c:7d -> 90:e2:ba:3e:a6:e8
 19 2018-02-09 08:59:07.244858    10.10.2.1 -> 10.10.1.1    TCP 80→51254 [RST] Seq=1 Win=0 Len=0 90:e2:ba:3e:a6:e8 -> 90:e2:ba:82:2c:7d
 20 2018-02-09 08:59:07.246925    10.10.1.1 -> 10.10.2.1    TCP [TCP Retransmission] 2082→1214 [ACK] Seq=1 Ack=1 Win=17188 Len=6 90:e2:ba:82:2c:7d -> 90:e2:ba:3e:a6:e8
 21 2018-02-09 08:59:07.249196    10.10.1.1 -> 10.10.2.1    TCP [TCP Retransmission] 10646→1469 [ACK] Seq=4294965917 Ack=1 Win=9660 Len=6 90:e2:ba:82:2c:7d -> 90:e2:ba:3e:a6:e8
 22 2018-02-09 08:59:07.251396    10.10.1.1 -> 10.10.2.1    TCP 4945→80 [ACK] Seq=1 Ack=1 Win=8760 Len=0 90:e2:ba:82:2c:7d -> 90:e2:ba:3e:a6:e8
 23 2018-02-09 08:59:07.251512    10.10.2.1 -> 10.10.1.1    TCP 80→4945 [RST] Seq=1 Win=0 Len=0 90:e2:ba:3e:a6:e8 -> 90:e2:ba:82:2c:7d
 24 2018-02-09 08:59:07.253734    10.10.1.1 -> 10.10.2.1    TCP 1059→80 [ACK] Seq=1 Ack=1 Win=8484 Len=0 90:e2:ba:82:2c:7d -> 90:e2:ba:3e:a6:e8
 25 2018-02-09 08:59:07.253845    10.10.2.1 -> 10.10.1.1    TCP 80→1059 [RST] Seq=1 Win=0 Len=0 90:e2:ba:3e:a6:e8 -> 90:e2:ba:82:2c:7d
 26 2018-02-09 08:59:07.255738    10.10.1.1 -> 10.10.2.1    TCP 9939→80 [PSH, ACK] Seq=2198757346 Ack=2281789079 Win=17520[Malformed Packet] 90:e2:ba:82:2c:7d -> 90:e2:ba:3e:a6:e8
 27 2018-02-09 08:59:07.257696    10.10.1.1 -> 10.10.2.1    TCP 60024→80 [FIN, ACK] Seq=3085108199 Ack=4093544958 Win=17520[Malformed Packet] 90:e2:ba:82:2c:7d -> 90:e2:ba:3e:a6:e8
 28 2018-02-09 08:59:07.259965    10.10.1.1 -> 10.10.2.1    TCP [TCP segment of a reassembled PDU] 90:e2:ba:82:2c:7d -> 90:e2:ba:3e:a6:e8
 29 2018-02-09 08:59:07.261694    10.10.1.1 -> 10.10.2.1    TCP 1322→80 [RST] Seq=1 Win=0 Len=0 90:e2:ba:82:2c:7d -> 90:e2:ba:3e:a6:e8
 30 2018-02-09 08:59:07.263700    10.10.1.1 -> 10.10.2.1    TCP 43980→25 [RST] Seq=1 Win=0 Len=0 90:e2:ba:82:2c:7d -> 90:e2:ba:3e:a6:e8
 31 2018-02-09 08:59:07.265628    10.10.1.1 -> 10.10.2.1    TCP 80→1570 [SYN, ACK] Seq=3124942518 Ack=3829827209 Win=17520 MSS=1460 90:e2:ba:82:2c:7d -> 90:e2:ba:3e:a6:e8
 32 2018-02-09 08:59:07.267433    10.10.1.1 -> 10.10.2.1    TCP [TCP Previous segment not captured] 10322→1373 [PSH, ACK] Seq=1415 Ack=1 Win=9898 Len=6 90:e2:ba:82:2c:7d -> 90:e2:ba:3e:a6:e8
 33 2018-02-09 08:59:07.269434    10.10.1.1 -> 10.10.2.1    TCP [TCP segment of a reassembled PDU] 90:e2:ba:82:2c:7d -> 90:e2:ba:3e:a6:e8
 34 2018-02-09 08:59:07.271385    10.10.1.1 -> 10.10.2.1    TCP [TCP Dup ACK 15#1] 2671→8080 [ACK] Seq=1 Ack=1 Win=8760 Len=0 90:e2:ba:82:2c:7d -> 90:e2:ba:3e:a6:e8
 35 2018-02-09 08:59:07.271500    10.10.2.1 -> 10.10.1.1    TCP 8080→2671 [RST] Seq=1 Win=0 Len=0 90:e2:ba:3e:a6:e8 -> 90:e2:ba:82:2c:7d
 36 2018-02-09 08:59:07.273670    10.10.1.1 -> 10.10.2.1    TCP [TCP Retransmission] 2082→1214 [ACK] Seq=1 Ack=1 Win=17188 Len=6 90:e2:ba:82:2c:7d -> 90:e2:ba:3e:a6:e8
 37 2018-02-09 08:59:07.275978    10.10.1.1 -> 10.10.2.1    TCP [TCP Dup ACK 5#1] 80→2436 [ACK] Seq=1 Ack=1 Win=8460 Len=0 90:e2:ba:82:2c:7d -> 90:e2:ba:3e:a6:e8
 38 2018-02-09 08:59:07.276088    10.10.2.1 -> 10.10.1.1    TCP 2436→80 [RST] Seq=1 Win=0 Len=0 90:e2:ba:3e:a6:e8 -> 90:e2:ba:82:2c:7d
 39 2018-02-09 08:59:07.278344    10.10.1.1 -> 10.10.2.1    TCP [TCP Dup ACK 22#1] 4945→80 [ACK] Seq=1 Ack=1 Win=8760 Len=0 90:e2:ba:82:2c:7d -> 90:e2:ba:3e:a6:e8
 40 2018-02-09 08:59:07.278447    10.10.2.1 -> 10.10.1.1    TCP 80→4945 [RST] Seq=1 Win=0 Len=0 90:e2:ba:3e:a6:e8 -> 90:e2:ba:82:2c:7d
 41 2018-02-09 08:59:07.280463    10.10.1.1 -> 10.10.2.1    TCP 80→21850 [SYN, ACK] Seq=2217835905 Ack=2303324095 Win=17520 MSS=1460 90:e2:ba:82:2c:7d -> 90:e2:ba:3e:a6:e8
 42 2018-02-09 08:59:07.282543    10.10.1.1 -> 10.10.2.1    TCP 60024→80 [FIN, ACK] Seq=3085108199 Ack=4093544958 Win=17520[Malformed Packet] 90:e2:ba:82:2c:7d -> 90:e2:ba:3e:a6:e8
 43 2018-02-09 08:59:07.284718    10.10.1.1 -> 10.10.2.1    TCP 4234→80 [ACK] Seq=1 Ack=1 Win=4288 Len=0 90:e2:ba:82:2c:7d -> 90:e2:ba:3e:a6:e8
 44 2018-02-09 08:59:07.284824    10.10.2.1 -> 10.10.1.1    TCP 80→4234 [RST] Seq=1 Win=0 Len=0 90:e2:ba:3e:a6:e8 -> 90:e2:ba:82:2c:7d
 45 2018-02-09 08:59:07.286989    10.10.1.1 -> 10.10.2.1    TCP 25→3965 [PSH, ACK] Seq=369485957 Ack=1543290807 Win=8908[Malformed Packet] 90:e2:ba:82:2c:7d -> 90:e2:ba:3e:a6:e8
 46 2018-02-09 08:59:07.288844    10.10.1.1 -> 10.10.2.1    TCP 4835→8080 [ACK] Seq=1 Ack=1 Win=23360 Len=0 90:e2:ba:82:2c:7d -> 90:e2:ba:3e:a6:e8
 47 2018-02-09 08:59:07.288954    10.10.2.1 -> 10.10.1.1    TCP 8080→4835 [RST] Seq=1 Win=0 Len=0 90:e2:ba:3e:a6:e8 -> 90:e2:ba:82:2c:7d
 48 2018-02-09 08:59:07.290989    10.10.1.1 -> 10.10.2.1    TCP [TCP segment of a reassembled PDU] 90:e2:ba:82:2c:7d -> 90:e2:ba:3e:a6:e8
 49 2018-02-09 08:59:07.293138    10.10.1.1 -> 10.10.2.1    TCP [TCP segment of a reassembled PDU] 90:e2:ba:82:2c:7d -> 90:e2:ba:3e:a6:e8
 50 2018-02-09 08:59:07.295257    10.10.1.1 -> 10.10.2.1    TCP [TCP segment of a reassembled PDU] 90:e2:ba:82:2c:7d -> 90:e2:ba:3e:a6:e8
 51 2018-02-09 08:59:07.297359    10.10.1.1 -> 10.10.2.1    TCP 80→49365 [PSH, ACK] Seq=3931780319 Ack=3608251601 Win=17135[Malformed Packet] 90:e2:ba:82:2c:7d -> 90:e2:ba:3e:a6:e8
 52 2018-02-09 08:59:07.299158    10.10.1.1 -> 10.10.2.1    TCP [TCP Retransmission] 10322→1373 [ACK] Seq=1 Ack=1 Win=9898 Len=6 90:e2:ba:82:2c:7d -> 90:e2:ba:3e:a6:e8
 53 2018-02-09 08:59:07.301392    10.10.1.1 -> 10.10.2.1    TCP [TCP Retransmission] 8080→2075 [PSH, ACK] Seq=1 Ack=1 Win=32120 Len=6 90:e2:ba:82:2c:7d -> 90:e2:ba:3e:a6:e8
 54 2018-02-09 08:59:07.303329    10.10.1.1 -> 10.10.2.1    TCP [TCP Retransmission] 80→20156 [ACK] Seq=1 Ack=1 Win=33580 Len=6 90:e2:ba:82:2c:7d -> 90:e2:ba:3e:a6:e8
 55 2018-02-09 08:59:07.305278    10.10.1.1 -> 10.10.2.1    TCP [TCP Retransmission] 2082→1214 [ACK] Seq=1 Ack=1 Win=17188 Len=6 90:e2:ba:82:2c:7d -> 90:e2:ba:3e:a6:e8
 56 2018-02-09 08:59:07.307246    10.10.1.1 -> 10.10.2.1    TCP [TCP Dup ACK 5#2] 80→2436 [ACK] Seq=1 Ack=1 Win=8460 Len=0 90:e2:ba:82:2c:7d -> 90:e2:ba:3e:a6:e8
 57 2018-02-09 08:59:07.307336    10.10.2.1 -> 10.10.1.1    TCP 2436→80 [RST] Seq=1 Win=0 Len=0 90:e2:ba:3e:a6:e8 -> 90:e2:ba:82:2c:7d
 58 2018-02-09 08:59:07.309194    10.10.1.1 -> 10.10.2.1    TCP [TCP Dup ACK 9#1] 3988→80 [ACK] Seq=1 Ack=1 Win=8760 Len=0 90:e2:ba:82:2c:7d -> 90:e2:ba:3e:a6:e8
 59 2018-02-09 08:59:07.309298    10.10.2.1 -> 10.10.1.1    TCP 80→3988 [RST] Seq=1 Win=0 Len=0 90:e2:ba:3e:a6:e8 -> 90:e2:ba:82:2c:7d
 60 2018-02-09 08:59:07.311200    10.10.1.1 -> 10.10.2.1    TCP 9939→80 [PSH, ACK] Seq=2198757346 Ack=2281789079 Win=17520[Malformed Packet] 90:e2:ba:82:2c:7d -> 90:e2:ba:3e:a6:e8
 61 2018-02-09 08:59:07.313292    10.10.1.1 -> 10.10.2.1    TCP 1755→3539 [PSH, ACK] Seq=1 Ack=1 Win=16080 Len=6 90:e2:ba:82:2c:7d -> 90:e2:ba:3e:a6:e8
 62 2018-02-09 08:59:07.315170    10.10.1.1 -> 10.10.2.1    TCP [TCP Dup ACK 43#1] 4234→80 [ACK] Seq=1 Ack=1 Win=4288 Len=0 90:e2:ba:82:2c:7d -> 90:e2:ba:3e:a6:e8
 63 2018-02-09 08:59:07.315282    10.10.2.1 -> 10.10.1.1    TCP 80→4234 [RST] Seq=1 Win=0 Len=0 90:e2:ba:3e:a6:e8 -> 90:e2:ba:82:2c:7d
 64 2018-02-09 08:59:07.317126    10.10.1.1 -> 10.10.2.1    TCP 43980→25 [RST] Seq=1 Win=0 Len=0 90:e2:ba:82:2c:7d -> 90:e2:ba:3e:a6:e8
 65 2018-02-09 08:59:07.318993    10.10.1.1 -> 10.10.2.1    TCP [TCP segment of a reassembled PDU] 90:e2:ba:82:2c:7d -> 90:e2:ba:3e:a6:e8
 66 2018-02-09 08:59:07.320945    10.10.1.1 -> 10.10.2.1    TCP 9941→80 [PSH, ACK] Seq=2199015092 Ack=2621007282 Win=17520[Malformed Packet] 90:e2:ba:82:2c:7d -> 90:e2:ba:3e:a6:e8
 67 2018-02-09 08:59:07.322707    10.10.1.1 -> 10.10.2.1    TCP 9941→80 [ACK] Seq=2199015092 Ack=2621007282 Win=17520[Malformed Packet] 90:e2:ba:82:2c:7d -> 90:e2:ba:3e:a6:e8
 68 2018-02-09 08:59:07.324568    10.10.1.1 -> 10.10.2.1    TCP 80→3016 [ACK] Seq=1 Ack=1 Win=8760 Len=6 90:e2:ba:82:2c:7d -> 90:e2:ba:3e:a6:e8
 69 2018-02-09 08:59:07.326494    10.10.1.1 -> 10.10.2.1    TCP 80→49365 [PSH, ACK] Seq=3931780319 Ack=3608251601 Win=17135[Malformed Packet] 90:e2:ba:82:2c:7d -> 90:e2:ba:3e:a6:e8
 70 2018-02-09 08:59:07.328308    10.10.1.1 -> 10.10.2.1    TCP 1053→49540 [ACK] Seq=1 Ack=1 Win=8760 Len=6 90:e2:ba:82:2c:7d -> 90:e2:ba:3e:a6:e8
 71 2018-02-09 08:59:07.330336    10.10.1.1 -> 10.10.2.1    TCP [TCP segment of a reassembled PDU] 90:e2:ba:82:2c:7d -> 90:e2:ba:3e:a6:e8
 72 2018-02-09 08:59:07.332142    10.10.1.1 -> 10.10.2.1    TCP [TCP Retransmission] 10646→1469 [ACK] Seq=4294965917 Ack=1 Win=9660 Len=6 90:e2:ba:82:2c:7d -> 90:e2:ba:3e:a6:e8
 73 2018-02-09 08:59:07.333739    10.10.1.1 -> 10.10.2.1    TCP 1755→35451 [PSH, ACK] Seq=1 Ack=1 Win=16224 Len=6 90:e2:ba:82:2c:7d -> 90:e2:ba:3e:a6:e8
 74 2018-02-09 08:59:07.335783    10.10.1.1 -> 10.10.2.1    TCP 51253→80 [ACK] Seq=1 Ack=1 Win=32120 Len=0 90:e2:ba:82:2c:7d -> 90:e2:ba:3e:a6:e8
 75 2018-02-09 08:59:07.335890    10.10.2.1 -> 10.10.1.1    TCP 80→51253 [RST] Seq=1 Win=0 Len=0 90:e2:ba:3e:a6:e8 -> 90:e2:ba:82:2c:7d
 76 2018-02-09 08:59:07.337477    10.10.1.1 -> 10.10.2.1    TCP 9939→80 [PSH, ACK] Seq=2198757346 Ack=2281789079 Win=17520[Malformed Packet] 90:e2:ba:82:2c:7d -> 90:e2:ba:3e:a6:e8
 77 2018-02-09 08:59:07.339347    10.10.1.1 -> 10.10.2.1    TCP 60024→80 [FIN, ACK] Seq=3085108199 Ack=4093544958 Win=17520[Malformed Packet] 90:e2:ba:82:2c:7d -> 90:e2:ba:3e:a6:e8
 78 2018-02-09 08:59:07.341044    10.10.1.1 -> 10.10.2.1    TCP 48901→80 [ACK] Seq=1 Ack=1 Win=46720 Len=0 90:e2:ba:82:2c:7d -> 90:e2:ba:3e:a6:e8
 79 2018-02-09 08:59:07.341147    10.10.2.1 -> 10.10.1.1    TCP 80→48901 [RST] Seq=1 Win=0 Len=0 90:e2:ba:3e:a6:e8 -> 90:e2:ba:82:2c:7d
 80 2018-02-09 08:59:07.342885    10.10.1.1 -> 10.10.2.1    TCP 43980→25 [RST] Seq=1 Win=0 Len=0 90:e2:ba:82:2c:7d -> 90:e2:ba:3e:a6:e8
 81 2018-02-09 08:59:07.344572    10.10.1.1 -> 10.10.2.1    TCP [TCP segment of a reassembled PDU] 90:e2:ba:82:2c:7d -> 90:e2:ba:3e:a6:e8
 82 2018-02-09 08:59:07.346389    10.10.1.1 -> 10.10.2.1    TCP 9941→80 [PSH, ACK] Seq=2199015092 Ack=2621007282 Win=17520[Malformed Packet] 90:e2:ba:82:2c:7d -> 90:e2:ba:3e:a6:e8
 83 2018-02-09 08:59:07.348147    10.10.1.1 -> 10.10.2.1    TCP 80→4312 [SYN, ACK] Seq=0 Ack=1 Win=8760 Len=0 MSS=1460 90:e2:ba:82:2c:7d -> 90:e2:ba:3e:a6:e8
 84 2018-02-09 08:59:07.348262    10.10.2.1 -> 10.10.1.1    TCP 4312→80 [RST] Seq=1 Win=0 Len=0 90:e2:ba:3e:a6:e8 -> 90:e2:ba:82:2c:7d
 85 2018-02-09 08:59:07.349808    10.10.1.1 -> 10.10.2.1    TCP 1755→64126 [ACK] Seq=1 Ack=1 Win=15600 Len=6 90:e2:ba:82:2c:7d -> 90:e2:ba:3e:a6:e8
 86 2018-02-09 08:59:07.351574    10.10.1.1 -> 10.10.2.1    TCP [TCP Retransmission] [TCP segment of a reassembled PDU] 90:e2:ba:82:2c:7d -> 90:e2:ba:3e:a6:e8
 87 2018-02-09 08:59:07.353249    10.10.1.1 -> 10.10.2.1    TCP 80→1077 [PSH, ACK] Seq=1 Ack=1 Win=32120 Len=6 90:e2:ba:82:2c:7d -> 90:e2:ba:3e:a6:e8
 88 2018-02-09 08:59:07.355041    10.10.1.1 -> 10.10.2.1    TCP [TCP Retransmission] 51253→80 [PSH, ACK] Seq=1 Ack=1 Win=32120 Len=6 90:e2:ba:82:2c:7d -> 90:e2:ba:3e:a6:e8
 89 2018-02-09 08:59:07.356761    10.10.1.1 -> 10.10.2.1    TCP [TCP Retransmission] 10646→1469 [PSH, ACK] Seq=1 Ack=1 Win=9660 Len=6 90:e2:ba:82:2c:7d -> 90:e2:ba:3e:a6:e8
 90 2018-02-09 08:59:07.358581    10.10.1.1 -> 10.10.2.1    TCP 8266→80 [FIN, ACK] Seq=1003409482 Ack=2273879807 Win=17520[Malformed Packet] 90:e2:ba:82:2c:7d -> 90:e2:ba:3e:a6:e8
 91 2018-02-09 08:59:07.360512    10.10.1.1 -> 10.10.2.1    TCP 60024→80 [ACK] Seq=1 Ack=1 Win=8209 Len=0 90:e2:ba:82:2c:7d -> 90:e2:ba:3e:a6:e8
 92 2018-02-09 08:59:07.360615    10.10.2.1 -> 10.10.1.1    TCP 80→60024 [RST] Seq=1 Win=0 Len=0 90:e2:ba:3e:a6:e8 -> 90:e2:ba:82:2c:7d
 93 2018-02-09 08:59:07.362113    10.10.1.1 -> 10.10.2.1    TCP [TCP Previous segment not captured] [TCP segment of a reassembled PDU] 90:e2:ba:82:2c:7d -> 90:e2:ba:3e:a6:e8
 94 2018-02-09 08:59:07.363949    10.10.1.1 -> 10.10.2.1    TCP 80→21850 [SYN, ACK] Seq=2217835905 Ack=2303324095 Win=17520 MSS=1460 90:e2:ba:82:2c:7d -> 90:e2:ba:3e:a6:e8
 95 2018-02-09 08:59:07.365500    10.10.1.1 -> 10.10.2.1    TCP [TCP Dup ACK 43#2] 4234→80 [ACK] Seq=1 Ack=1 Win=4288 Len=0 90:e2:ba:82:2c:7d -> 90:e2:ba:3e:a6:e8
 96 2018-02-09 08:59:07.365605    10.10.2.1 -> 10.10.1.1    TCP 80→4234 [RST] Seq=1 Win=0 Len=0 90:e2:ba:3e:a6:e8 -> 90:e2:ba:82:2c:7d
 97 2018-02-09 08:59:07.367271    10.10.1.1 -> 10.10.2.1    TCP 1322→80 [RST] Seq=1 Win=0 Len=0 90:e2:ba:82:2c:7d -> 90:e2:ba:3e:a6:e8
 98 2018-02-09 08:59:07.368963    10.10.1.1 -> 10.10.2.1    TCP [TCP Retransmission] 25→3561 [PSH, ACK] Seq=1 Ack=1 Win=17520 Len=6 90:e2:ba:82:2c:7d -> 90:e2:ba:3e:a6:e8
 99 2018-02-09 08:59:07.370829    10.10.1.1 -> 10.10.2.1    TCP 30737→80 [ACK] Seq=1 Ack=1 Win=64240 Len=0 90:e2:ba:82:2c:7d -> 90:e2:ba:3e:a6:e8
100 2018-02-09 08:59:07.370907    10.10.2.1 -> 10.10.1.1    TCP 80→30737 [RST] Seq=1 Win=0 Len=0 90:e2:ba:3e:a6:e8 -> 90:e2:ba:82:2c:7d
101 2018-02-09 08:59:07.373493    10.10.1.1 -> 10.10.2.1    TCP [TCP Retransmission] 80→3830 [ACK] Seq=1 Ack=1 Win=65535 Len=6 90:e2:ba:82:2c:7d -> 90:e2:ba:3e:a6:e8
102 2018-02-09 08:59:07.376013    10.10.1.1 -> 10.10.2.1    TCP 80→2194 [FIN, ACK] Seq=1 Ack=1 Win=16616 Len=0 90:e2:ba:82:2c:7d -> 90:e2:ba:3e:a6:e8
103 2018-02-09 08:59:07.376121    10.10.2.1 -> 10.10.1.1    TCP 2194→80 [RST] Seq=1 Win=0 Len=0 90:e2:ba:3e:a6:e8 -> 90:e2:ba:82:2c:7d
104 2018-02-09 08:59:07.378198    10.10.1.1 -> 10.10.2.1    TCP [TCP Retransmission] 10322→1373 [ACK] Seq=1 Ack=1 Win=9898 Len=6 90:e2:ba:82:2c:7d -> 90:e2:ba:3e:a6:e8
105 2018-02-09 08:59:07.380275    10.10.1.1 -> 10.10.2.1    TCP [TCP Retransmission] 80→1077 [PSH, ACK] Seq=1 Ack=1 Win=32120 Len=6 90:e2:ba:82:2c:7d -> 90:e2:ba:3e:a6:e8
106 2018-02-09 08:59:07.382242    10.10.1.1 -> 10.10.2.1    TCP [TCP Dup ACK 18#1] 51254→80 [ACK] Seq=1 Ack=1 Win=32120 Len=0 90:e2:ba:82:2c:7d -> 90:e2:ba:3e:a6:e8
107 2018-02-09 08:59:07.382336    10.10.2.1 -> 10.10.1.1    TCP 80→51254 [RST] Seq=1 Win=0 Len=0 90:e2:ba:3e:a6:e8 -> 90:e2:ba:82:2c:7d
108 2018-02-09 08:59:07.384390    10.10.1.1 -> 10.10.2.1    TCP 47302→80 [ACK] Seq=1394080085 Ack=3266262189 Win=17520[Malformed Packet] 90:e2:ba:82:2c:7d -> 90:e2:ba:3e:a6:e8
109 2018-02-09 08:59:07.386451    10.10.1.1 -> 10.10.2.1    TCP [TCP Retransmission] 10646→1469 [ACK] Seq=4294964826 Ack=1 Win=9660 Len=6 90:e2:ba:82:2c:7d -> 90:e2:ba:3e:a6:e8
110 2018-02-09 08:59:07.388309    10.10.1.1 -> 10.10.2.1    TCP [TCP Retransmission] 1755→35451 [PSH, ACK] Seq=1 Ack=1 Win=16224 Len=6 90:e2:ba:82:2c:7d -> 90:e2:ba:3e:a6:e8
111 2018-02-09 08:59:07.390215    10.10.1.1 -> 10.10.2.1    TCP 51253→80 [ACK] Seq=1 Ack=1 Win=32120 Len=0 90:e2:ba:82:2c:7d -> 90:e2:ba:3e:a6:e8
112 2018-02-09 08:59:07.390304    10.10.2.1 -> 10.10.1.1    TCP 80→51253 [RST] Seq=1 Win=0 Len=0 90:e2:ba:3e:a6:e8 -> 90:e2:ba:82:2c:7d
113 2018-02-09 08:59:07.392407    10.10.1.1 -> 10.10.2.1    TCP [TCP Dup ACK 24#1] 1059→80 [ACK] Seq=1 Ack=1 Win=8484 Len=0 90:e2:ba:82:2c:7d -> 90:e2:ba:3e:a6:e8
114 2018-02-09 08:59:07.392504    10.10.2.1 -> 10.10.1.1    TCP 80→1059 [RST] Seq=1 Win=0 Len=0 90:e2:ba:3e:a6:e8 -> 90:e2:ba:82:2c:7d
115 2018-02-09 08:59:07.394999    10.10.1.1 -> 10.10.2.1    TCP [TCP Retransmission] 1755→3539 [PSH, ACK] Seq=1 Ack=1 Win=16080 Len=6 90:e2:ba:82:2c:7d -> 90:e2:ba:3e:a6:e8
116 2018-02-09 08:59:07.396583    10.10.1.1 -> 10.10.2.1    TCP [TCP Retransmission] 80→33670 [PSH, ACK] Seq=1 Ack=1 Win=63832 Len=6 90:e2:ba:82:2c:7d -> 90:e2:ba:3e:a6:e8
117 2018-02-09 08:59:07.398081    10.10.1.1 -> 10.10.2.1    TCP [TCP Retransmission] [TCP segment of a reassembled PDU] 90:e2:ba:82:2c:7d -> 90:e2:ba:3e:a6:e8
118 2018-02-09 08:59:07.399304    10.10.1.1 -> 10.10.2.1    TCP 25→3965 [PSH, ACK] Seq=369485957 Ack=1543290807 Win=8908[Malformed Packet] 90:e2:ba:82:2c:7d -> 90:e2:ba:3e:a6:e8
119 2018-02-09 08:59:07.400536    10.10.1.1 -> 10.10.2.1    TCP [TCP segment of a reassembled PDU] 90:e2:ba:82:2c:7d -> 90:e2:ba:3e:a6:e8
120 2018-02-09 08:59:07.401780    10.10.1.1 -> 10.10.2.1    TCP 9949→80 [PSH, ACK] Seq=2201617779 Ack=3464876108 Win=17520[Malformed Packet] 90:e2:ba:82:2c:7d -> 90:e2:ba:3e:a6:e8
121 2018-02-09 08:59:07.403175    10.10.1.1 -> 10.10.2.1    TCP 80→1570 [SYN, ACK] Seq=3124942518 Ack=3829827209 Win=17520 MSS=1460 90:e2:ba:82:2c:7d -> 90:e2:ba:3e:a6:e8
122 2018-02-09 08:59:07.404402    10.10.1.1 -> 10.10.2.1    TCP 80→49365 [PSH, ACK] Seq=3931780319 Ack=3608251601 Win=17135[Malformed Packet] 90:e2:ba:82:2c:7d -> 90:e2:ba:3e:a6:e8
123 2018-02-09 08:59:07.405756    10.10.1.1 -> 10.10.2.1    TCP [TCP Retransmission] 80→1077 [ACK] Seq=4294965837 Ack=1 Win=32120 Len=6 90:e2:ba:82:2c:7d -> 90:e2:ba:3e:a6:e8
124 2018-02-09 08:59:07.406996    10.10.1.1 -> 10.10.2.1    TCP [TCP Dup ACK 15#2] 2671→8080 [ACK] Seq=1 Ack=1 Win=8760 Len=0 90:e2:ba:82:2c:7d -> 90:e2:ba:3e:a6:e8
125 2018-02-09 08:59:07.407085    10.10.2.1 -> 10.10.1.1    TCP 8080→2671 [RST] Seq=1 Win=0 Len=0 90:e2:ba:3e:a6:e8 -> 90:e2:ba:82:2c:7d
126 2018-02-09 08:59:07.408219    10.10.1.1 -> 10.10.2.1    TCP [TCP Dup ACK 18#2] 51254→80 [ACK] Seq=1 Ack=1 Win=32120 Len=0 90:e2:ba:82:2c:7d -> 90:e2:ba:3e:a6:e8
127 2018-02-09 08:59:07.408313    10.10.2.1 -> 10.10.1.1    TCP 80→51254 [RST] Seq=1 Win=0 Len=0 90:e2:ba:3e:a6:e8 -> 90:e2:ba:82:2c:7d
128 2018-02-09 08:59:07.409457    10.10.1.1 -> 10.10.2.1    TCP [TCP Retransmission] 2082→1214 [ACK] Seq=1 Ack=1 Win=17188 Len=6 90:e2:ba:82:2c:7d -> 90:e2:ba:3e:a6:e8
129 2018-02-09 08:59:07.410672    10.10.1.1 -> 10.10.2.1    TCP [TCP Retransmission] 10646→1469 [ACK] Seq=4294965917 Ack=1 Win=9660 Len=6 90:e2:ba:82:2c:7d -> 90:e2:ba:3e:a6:e8
130 2018-02-09 08:59:07.411679    10.10.1.1 -> 10.10.2.1    TCP [TCP Retransmission] 1755→35451 [ACK] Seq=4294965837 Ack=1 Win=16224 Len=6 90:e2:ba:82:2c:7d -> 90:e2:ba:3e:a6:e8
131 2018-02-09 08:59:07.412770    10.10.1.1 -> 10.10.2.1    TCP 8080→2102 [ACK] Seq=3143204609 Ack=1168230855 Win=17376[Malformed Packet] 90:e2:ba:82:2c:7d -> 90:e2:ba:3e:a6:e8
132 2018-02-09 08:59:07.413768    10.10.1.1 -> 10.10.2.1    TCP 80→21850 [SYN, ACK] Seq=2217835905 Ack=2303324095 Win=17520 MSS=1460 90:e2:ba:82:2c:7d -> 90:e2:ba:3e:a6:e8
133 2018-02-09 08:59:07.414776    10.10.1.1 -> 10.10.2.1    TCP 1060→6699 [PSH, ACK] Seq=1 Ack=1 Win=17520 Len=6 90:e2:ba:82:2c:7d -> 90:e2:ba:3e:a6:e8
134 2018-02-09 08:59:07.415900    10.10.1.1 -> 10.10.2.1    TCP [TCP Dup ACK 43#3] 4234→80 [ACK] Seq=1 Ack=1 Win=4288 Len=0 90:e2:ba:82:2c:7d -> 90:e2:ba:3e:a6:e8
135 2018-02-09 08:59:07.416001    10.10.2.1 -> 10.10.1.1    TCP 80→4234 [RST] Seq=1 Win=0 Len=0 90:e2:ba:3e:a6:e8 -> 90:e2:ba:82:2c:7d
136 2018-02-09 08:59:07.416897    10.10.1.1 -> 10.10.2.1    TCP 43980→25 [RST] Seq=1 Win=0 Len=0 90:e2:ba:82:2c:7d -> 90:e2:ba:3e:a6:e8
137 2018-02-09 08:59:07.417879    10.10.1.1 -> 10.10.2.1    TCP 80→1401 [ACK] Seq=1 Ack=1 Win=33580 Len=0 90:e2:ba:82:2c:7d -> 90:e2:ba:3e:a6:e8
138 2018-02-09 08:59:07.417969    10.10.2.1 -> 10.10.1.1    TCP 1401→80 [RST] Seq=1 Win=0 Len=0 90:e2:ba:3e:a6:e8 -> 90:e2:ba:82:2c:7d
139 2018-02-09 08:59:07.418910    10.10.1.1 -> 10.10.2.1    TCP 8478→63476 [PSH, ACK] Seq=1 Ack=1 Win=8760 Len=6 90:e2:ba:82:2c:7d -> 90:e2:ba:3e:a6:e8
140 2018-02-09 08:59:07.420008    10.10.1.1 -> 10.10.2.1    TCP 9941→80 [ACK] Seq=2199015092 Ack=2621007282 Win=17520[Malformed Packet] 90:e2:ba:82:2c:7d -> 90:e2:ba:3e:a6:e8
141 2018-02-09 08:59:07.420951    10.10.1.1 -> 10.10.2.1    TCP [TCP Retransmission] 80→3016 [ACK] Seq=1 Ack=1 Win=8760 Len=6 90:e2:ba:82:2c:7d -> 90:e2:ba:3e:a6:e8
142 2018-02-09 08:59:07.421989    10.10.1.1 -> 10.10.2.1    TCP 80→49365 [ACK] Seq=3931778871 Ack=3608251601 Win=17135[Malformed Packet] 90:e2:ba:82:2c:7d -> 90:e2:ba:3e:a6:e8
143 2018-02-09 08:59:07.423081    10.10.1.1 -> 10.10.2.1    TCP [TCP Retransmission] [TCP segment of a reassembled PDU] 90:e2:ba:82:2c:7d -> 90:e2:ba:3e:a6:e8
144 2018-02-09 08:59:07.424081    10.10.1.1 -> 10.10.2.1    TCP [TCP Retransmission] 80→20156 [ACK] Seq=1 Ack=1 Win=33580 Len=6 90:e2:ba:82:2c:7d -> 90:e2:ba:3e:a6:e8
145 2018-02-09 08:59:07.425170    10.10.1.1 -> 10.10.2.1    TCP [TCP segment of a reassembled PDU] 90:e2:ba:82:2c:7d -> 90:e2:ba:3e:a6:e8
146 2018-02-09 08:59:07.426172    10.10.1.1 -> 10.10.2.1    TCP [TCP Retransmission] 10646→1469 [ACK] Seq=4294965917 Ack=1 Win=9660 Len=6 90:e2:ba:82:2c:7d -> 90:e2:ba:3e:a6:e8
147 2018-02-09 08:59:07.427290    10.10.1.1 -> 10.10.2.1    UDP Source port: 6003  Destination port: 6003 [BAD UDP LENGTH 122 > IP PAYLOAD LENGTH] 90:e2:ba:82:2c:7d -> 90:e2:ba:3e:a6:e8
148 2018-02-09 08:59:07.428354    10.10.1.1 -> 10.10.2.1    TCP 9939→80 [PSH, ACK] Seq=2198757346 Ack=2281789079 Win=17520[Malformed Packet] 90:e2:ba:82:2c:7d -> 90:e2:ba:3e:a6:e8
149 2018-02-09 08:59:07.429419    10.10.1.1 -> 10.10.2.1    TCP [TCP Retransmission] 1755→3539 [PSH, ACK] Seq=1 Ack=1 Win=16080 Len=6 90:e2:ba:82:2c:7d -> 90:e2:ba:3e:a6:e8
150 2018-02-09 08:59:07.430492    10.10.1.1 -> 10.10.2.1    TCP 4662→65158 [ACK] Seq=1 Ack=1 Win=64635 Len=0 90:e2:ba:82:2c:7d -> 90:e2:ba:3e:a6:e8
151 2018-02-09 08:59:07.430603    10.10.2.1 -> 10.10.1.1    TCP 65158→4662 [RST] Seq=1 Win=0 Len=0 90:e2:ba:3e:a6:e8 -> 90:e2:ba:82:2c:7d
152 2018-02-09 08:59:07.431550    10.10.1.1 -> 10.10.2.1    TCP 43980→25 [RST] Seq=1 Win=0 Len=0 90:e2:ba:82:2c:7d -> 90:e2:ba:3e:a6:e8
153 2018-02-09 08:59:07.432622    10.10.1.1 -> 10.10.2.1    TCP [TCP Retransmission] 25→3561 [PSH, ACK] Seq=1 Ack=1 Win=17520 Len=6 90:e2:ba:82:2c:7d -> 90:e2:ba:3e:a6:e8
154 2018-02-09 08:59:07.433614    10.10.1.1 -> 10.10.2.1    TCP [TCP Retransmission] 8478→63476 [PSH, ACK] Seq=1 Ack=1 Win=8760 Len=6 90:e2:ba:82:2c:7d -> 90:e2:ba:3e:a6:e8
155 2018-02-09 08:59:07.434700    10.10.1.1 -> 10.10.2.1    TCP 9949→80 [PSH, ACK] Seq=2201617779 Ack=3464876108 Win=17520[Malformed Packet] 90:e2:ba:82:2c:7d -> 90:e2:ba:3e:a6:e8
156 2018-02-09 08:59:07.435799    10.10.1.1 -> 10.10.2.1    TCP 64789→80 [ACK] Seq=1 Ack=1 Win=65340 Len=0 90:e2:ba:82:2c:7d -> 90:e2:ba:3e:a6:e8
157 2018-02-09 08:59:07.435945    10.10.2.1 -> 10.10.1.1    TCP 80→64789 [RST] Seq=1 Win=0 Len=0 90:e2:ba:3e:a6:e8 -> 90:e2:ba:82:2c:7d
158 2018-02-09 08:59:07.436834    10.10.1.1 -> 10.10.2.1    TCP [TCP Retransmission] 10322→1373 [ACK] Seq=1 Ack=1 Win=9898 Len=6 90:e2:ba:82:2c:7d -> 90:e2:ba:3e:a6:e8
159 2018-02-09 08:59:07.437837    10.10.1.1 -> 10.10.2.1    TCP 15058→80 [ACK] Seq=1552637778 Ack=3068943465 Win=17520[Malformed Packet] 90:e2:ba:82:2c:7d -> 90:e2:ba:3e:a6:e8
160 2018-02-09 08:59:07.438932    10.10.1.1 -> 10.10.2.1    TCP [TCP Dup ACK 18#3] 51254→80 [ACK] Seq=1 Ack=1 Win=32120 Len=0 90:e2:ba:82:2c:7d -> 90:e2:ba:3e:a6:e8
161 2018-02-09 08:59:07.439057    10.10.2.1 -> 10.10.1.1    TCP 80→51254 [RST] Seq=1 Win=0 Len=0 90:e2:ba:3e:a6:e8 -> 90:e2:ba:82:2c:7d
162 2018-02-09 08:59:07.439970    10.10.1.1 -> 10.10.2.1    TCP [TCP Retransmission] 10646→1469 [PSH, ACK] Seq=1 Ack=1 Win=9660 Len=6 90:e2:ba:82:2c:7d -> 90:e2:ba:3e:a6:e8
163 2018-02-09 08:59:07.441021    10.10.1.1 -> 10.10.2.1    TCP [TCP Dup ACK 22#2] 4945→80 [ACK] Seq=1 Ack=1 Win=8760 Len=0 90:e2:ba:82:2c:7d -> 90:e2:ba:3e:a6:e8
164 2018-02-09 08:59:07.441114    10.10.2.1 -> 10.10.1.1    TCP 80→4945 [RST] Seq=1 Win=0 Len=0 90:e2:ba:3e:a6:e8 -> 90:e2:ba:82:2c:7d
165 2018-02-09 08:59:07.442036    10.10.1.1 -> 10.10.2.1    TCP 51253→80 [ACK] Seq=1 Ack=1 Win=32120 Len=0 90:e2:ba:82:2c:7d -> 90:e2:ba:3e:a6:e8
166 2018-02-09 08:59:07.442144    10.10.2.1 -> 10.10.1.1    TCP 80→51253 [RST] Seq=1 Win=0 Len=0 90:e2:ba:3e:a6:e8 -> 90:e2:ba:82:2c:7d
167 2018-02-09 08:59:07.443135    10.10.1.1 -> 10.10.2.1    TCP 9939→80 [PSH, ACK] Seq=2198757346 Ack=2281789079 Win=17520[Malformed Packet] 90:e2:ba:82:2c:7d -> 90:e2:ba:3e:a6:e8
168 2018-02-09 08:59:07.444181    10.10.1.1 -> 10.10.2.1    TCP 60024→80 [FIN, ACK] Seq=3085108199 Ack=4093544958 Win=17520[Malformed Packet] 90:e2:ba:82:2c:7d -> 90:e2:ba:3e:a6:e8
169 2018-02-09 08:59:07.445154    10.10.1.1 -> 10.10.2.1    TCP 4656→6699 [PSH, ACK] Seq=1 Ack=1 Win=15557 Len=6 90:e2:ba:82:2c:7d -> 90:e2:ba:3e:a6:e8
170 2018-02-09 08:59:07.446206    10.10.1.1 -> 10.10.2.1    TCP 1322→80 [RST] Seq=1 Win=0 Len=0 90:e2:ba:82:2c:7d -> 90:e2:ba:3e:a6:e8
171 2018-02-09 08:59:07.447318    10.10.1.1 -> 10.10.2.1    TCP 25→3965 [PSH, ACK] Seq=369485957 Ack=1543290807 Win=8908[Malformed Packet] 90:e2:ba:82:2c:7d -> 90:e2:ba:3e:a6:e8
172 2018-02-09 08:59:07.448177    10.10.1.1 -> 10.10.2.1    TCP [TCP Retransmission] 80→1728 [PSH, ACK] Seq=1 Ack=1 Win=32522 Len=6 90:e2:ba:82:2c:7d -> 90:e2:ba:3e:a6:e8
173 2018-02-09 08:59:07.449042    10.10.1.1 -> 10.10.2.1    TCP 9949→80 [PSH, ACK] Seq=2201617779 Ack=3464876108 Win=17520[Malformed Packet] 90:e2:ba:82:2c:7d -> 90:e2:ba:3e:a6:e8
174 2018-02-09 08:59:07.449983    10.10.1.1 -> 10.10.2.1    TCP [TCP Retransmission] 80→2194 [FIN, ACK] Seq=1 Ack=1 Win=16616 Len=0 90:e2:ba:82:2c:7d -> 90:e2:ba:3e:a6:e8
175 2018-02-09 08:59:07.450073    10.10.2.1 -> 10.10.1.1    TCP 2194→80 [RST] Seq=1 Win=0 Len=0 90:e2:ba:3e:a6:e8 -> 90:e2:ba:82:2c:7d
176 2018-02-09 08:59:07.450889    10.10.1.1 -> 10.10.2.1    TCP 80→49365 [PSH, ACK] Seq=3931780319 Ack=3608251601 Win=17135[Malformed Packet] 90:e2:ba:82:2c:7d -> 90:e2:ba:3e:a6:e8
177 2018-02-09 08:59:07.451770    10.10.1.1 -> 10.10.2.1    TCP [TCP Retransmission] 80→1077 [PSH, ACK] Seq=1 Ack=1 Win=32120 Len=6 90:e2:ba:82:2c:7d -> 90:e2:ba:3e:a6:e8
178 2018-02-09 08:59:07.452659    10.10.1.1 -> 10.10.2.1    TCP 1462→80 [ACK] Seq=1 Ack=1 Win=16616 Len=0 90:e2:ba:82:2c:7d -> 90:e2:ba:3e:a6:e8
179 2018-02-09 08:59:07.452749    10.10.2.1 -> 10.10.1.1    TCP 80→1462 [RST] Seq=1 Win=0 Len=0 90:e2:ba:3e:a6:e8 -> 90:e2:ba:82:2c:7d
180 2018-02-09 08:59:07.453557    10.10.1.1 -> 10.10.2.1    TCP [TCP Retransmission] 10646→1469 [ACK] Seq=4294965917 Ack=1 Win=9660 Len=6 90:e2:ba:82:2c:7d -> 90:e2:ba:3e:a6:e8
181 2018-02-09 08:59:07.454458    10.10.1.1 -> 10.10.2.1    TCP 5762→80 [SYN] Seq=1851051921 Win=65535 MSS=1460 90:e2:ba:82:2c:7d -> 90:e2:ba:3e:a6:e8
182 2018-02-09 08:59:07.455326    10.10.1.1 -> 10.10.2.1    TCP 8080→2102 [ACK] Seq=3143204609 Ack=1168230855 Win=17376[Malformed Packet] 90:e2:ba:82:2c:7d -> 90:e2:ba:3e:a6:e8
183 2018-02-09 08:59:07.456182    10.10.1.1 -> 10.10.2.1    TCP 80→21850 [SYN, ACK] Seq=2217835905 Ack=2303324095 Win=17520 MSS=1460 90:e2:ba:82:2c:7d -> 90:e2:ba:3e:a6:e8
184 2018-02-09 08:59:07.456976    10.10.1.1 -> 10.10.2.1    TCP 60024→80 [FIN, ACK] Seq=3085108199 Ack=4093544958 Win=17520[Malformed Packet] 90:e2:ba:82:2c:7d -> 90:e2:ba:3e:a6:e8
185 2018-02-09 08:59:07.458001    10.10.1.1 -> 10.10.2.1    TCP [TCP Retransmission] 4656→6699 [PSH, ACK] Seq=1 Ack=1 Win=15557 Len=6 90:e2:ba:82:2c:7d -> 90:e2:ba:3e:a6:e8
186 2018-02-09 08:59:07.458865    10.10.1.1 -> 10.10.2.1    TCP 43980→25 [RST] Seq=1 Win=0 Len=0 90:e2:ba:82:2c:7d -> 90:e2:ba:3e:a6:e8
187 2018-02-09 08:59:07.459751    10.10.1.1 -> 10.10.2.1    TCP 25→3965 [PSH, ACK] Seq=369485957 Ack=1543290807 Win=8908[Malformed Packet] 90:e2:ba:82:2c:7d -> 90:e2:ba:3e:a6:e8
188 2018-02-09 08:59:07.460581    10.10.1.1 -> 10.10.2.1    TCP [TCP Retransmission] 8478→63476 [PSH, ACK] Seq=1 Ack=1 Win=8760 Len=6 90:e2:ba:82:2c:7d -> 90:e2:ba:3e:a6:e8
189 2018-02-09 08:59:07.461482    10.10.1.1 -> 10.10.2.1    TCP [TCP Retransmission] 80→3830 [ACK] Seq=1 Ack=1 Win=65535 Len=6 90:e2:ba:82:2c:7d -> 90:e2:ba:3e:a6:e8
190 2018-02-09 08:59:07.528516    10.10.1.1 -> 10.10.2.1    TCP [TCP Retransmission] 80→3016 [ACK] Seq=1 Ack=1 Win=8760 Len=6 90:e2:ba:82:2c:7d -> 90:e2:ba:3e:a6:e8
191 2018-02-09 08:59:07.529515    10.10.1.1 -> 10.10.2.1    TCP [TCP Retransmission] 80→20156 [ACK] Seq=4294966121 Ack=1 Win=33580 Len=6 90:e2:ba:82:2c:7d -> 90:e2:ba:3e:a6:e8
192 2018-02-09 08:59:07.530599    10.10.1.1 -> 10.10.2.1    TCP [TCP Retransmission] 8080→2075 [PSH, ACK] Seq=1 Ack=1 Win=32120 Len=6 90:e2:ba:82:2c:7d -> 90:e2:ba:3e:a6:e8
193 2018-02-09 08:59:07.531959    10.10.1.1 -> 10.10.2.1    TCP [TCP Retransmission] 51253→80 [PSH, ACK] Seq=1 Ack=1 Win=32120 Len=6 90:e2:ba:82:2c:7d -> 90:e2:ba:3e:a6:e8
194 2018-02-09 08:59:07.533536    10.10.1.1 -> 10.10.2.1    TCP [TCP Retransmission] 10646→1469 [PSH, ACK] Seq=1 Ack=1 Win=9660 Len=6 90:e2:ba:82:2c:7d -> 90:e2:ba:3e:a6:e8
195 2018-02-09 08:59:07.535143    10.10.1.1 -> 10.10.2.1    TCP 5762→80 [SYN] Seq=1851051921 Win=65535 MSS=1460 90:e2:ba:82:2c:7d -> 90:e2:ba:3e:a6:e8
196 2018-02-09 08:59:07.536728    10.10.1.1 -> 10.10.2.1    TCP [TCP Retransmission] 1755→3539 [PSH, ACK] Seq=1 Ack=1 Win=16080 Len=6 90:e2:ba:82:2c:7d -> 90:e2:ba:3e:a6:e8
197 2018-02-09 08:59:07.538330    10.10.1.1 -> 10.10.2.1    TCP [TCP Dup ACK 43#4] 4234→80 [ACK] Seq=1 Ack=1 Win=4288 Len=0 90:e2:ba:82:2c:7d -> 90:e2:ba:3e:a6:e8
198 2018-02-09 08:59:07.538449    10.10.2.1 -> 10.10.1.1    TCP 80→4234 [RST] Seq=1 Win=0 Len=0 90:e2:ba:3e:a6:e8 -> 90:e2:ba:82:2c:7d
199 2018-02-09 08:59:07.619864    10.10.1.1 -> 10.10.2.1    TCP 80→65119 [PSH, ACK] Seq=1 Ack=1 Win=8760 Len=6 90:e2:ba:82:2c:7d -> 90:e2:ba:3e:a6:e8
200 2018-02-09 08:59:07.621381    10.10.1.1 -> 10.10.2.1    TCP [TCP Retransmission] 80→33670 [ACK] Seq=4294965837 Ack=1 Win=63832 Len=6 90:e2:ba:82:2c:7d -> 90:e2:ba:3e:a6:e8
201 2018-02-09 08:59:07.622943    10.10.1.1 -> 10.10.2.1    TCP [TCP Retransmission] 80→2194 [FIN, ACK] Seq=1 Ack=1 Win=16616 Len=0 90:e2:ba:82:2c:7d -> 90:e2:ba:3e:a6:e8
202 2018-02-09 08:59:07.623083    10.10.2.1 -> 10.10.1.1    TCP 2194→80 [RST] Seq=1 Win=0 Len=0 90:e2:ba:3e:a6:e8 -> 90:e2:ba:82:2c:7d
203 2018-02-09 08:59:07.624557    10.10.1.1 -> 10.10.2.1    TCP 47302→80 [ACK] Seq=1394080085 Ack=3266262189 Win=17520[Malformed Packet] 90:e2:ba:82:2c:7d -> 90:e2:ba:3e:a6:e8
204 2018-02-09 08:59:07.626175    10.10.1.1 -> 10.10.2.1    TCP 8266→80 [FIN, ACK] Seq=1003409482 Ack=2273879807 Win=17520[Malformed Packet] 90:e2:ba:82:2c:7d -> 90:e2:ba:3e:a6:e8
205 2018-02-09 08:59:07.627749    10.10.1.1 -> 10.10.2.1    TCP [TCP Retransmission] 80→65119 [PSH, ACK] Seq=1 Ack=1 Win=8760 Len=6 90:e2:ba:82:2c:7d -> 90:e2:ba:3e:a6:e8
206 2018-02-09 08:59:07.629298    10.10.1.1 -> 10.10.2.1    TCP [TCP Retransmission] 1755→3539 [PSH, ACK] Seq=1 Ack=1 Win=16080 Len=6 90:e2:ba:82:2c:7d -> 90:e2:ba:3e:a6:e8
207 2018-02-09 08:59:07.630927    10.10.1.1 -> 10.10.2.1    TCP [TCP Dup ACK 43#5] 4234→80 [ACK] Seq=1 Ack=1 Win=4288 Len=0 90:e2:ba:82:2c:7d -> 90:e2:ba:3e:a6:e8
208 2018-02-09 08:59:07.631066    10.10.2.1 -> 10.10.1.1    TCP 80→4234 [RST] Seq=1 Win=0 Len=0 90:e2:ba:3e:a6:e8 -> 90:e2:ba:82:2c:7d
209 2018-02-09 08:59:07.632518    10.10.1.1 -> 10.10.2.1    TCP [TCP Dup ACK 46#1] 4835→8080 [ACK] Seq=1 Ack=1 Win=23360 Len=0 90:e2:ba:82:2c:7d -> 90:e2:ba:3e:a6:e8
210 2018-02-09 08:59:07.632620    10.10.2.1 -> 10.10.1.1    TCP 8080→4835 [RST] Seq=1 Win=0 Len=0 90:e2:ba:3e:a6:e8 -> 90:e2:ba:82:2c:7d
211 2018-02-09 08:59:07.634198    10.10.1.1 -> 10.10.2.1    TCP [TCP Retransmission] 8478→63476 [PSH, ACK] Seq=1 Ack=1 Win=8760 Len=6 90:e2:ba:82:2c:7d -> 90:e2:ba:3e:a6:e8
212 2018-02-09 08:59:07.635713    10.10.1.1 -> 10.10.2.1    TCP [TCP Retransmission] 1755→64126 [ACK] Seq=1 Ack=1 Win=15600 Len=6 90:e2:ba:82:2c:7d -> 90:e2:ba:3e:a6:e8
213 2018-02-09 08:59:07.637168    10.10.1.1 -> 10.10.2.1    TCP 47302→80 [ACK] Seq=1394080085 Ack=3266262189 Win=17520[Malformed Packet] 90:e2:ba:82:2c:7d -> 90:e2:ba:3e:a6:e8
214 2018-02-09 08:59:07.638717    10.10.1.1 -> 10.10.2.1    TCP 5762→80 [SYN] Seq=1851051921 Win=65535 MSS=1460 90:e2:ba:82:2c:7d -> 90:e2:ba:3e:a6:e8
215 2018-02-09 08:59:07.640238    10.10.1.1 -> 10.10.2.1    TCP [TCP Dup ACK 24#2] 1059→80 [ACK] Seq=1 Ack=1 Win=8484 Len=0 90:e2:ba:82:2c:7d -> 90:e2:ba:3e:a6:e8
216 2018-02-09 08:59:07.640366    10.10.2.1 -> 10.10.1.1    TCP 80→1059 [RST] Seq=1 Win=0 Len=0 90:e2:ba:3e:a6:e8 -> 90:e2:ba:82:2c:7d
217 2018-02-09 08:59:07.641754    10.10.1.1 -> 10.10.2.1    TCP [TCP Retransmission] 80→65119 [PSH, ACK] Seq=1 Ack=1 Win=8760 Len=6 90:e2:ba:82:2c:7d -> 90:e2:ba:3e:a6:e8
218 2018-02-09 08:59:07.643245    10.10.1.1 -> 10.10.2.1    TCP [TCP Dup ACK 43#6] 4234→80 [ACK] Seq=1 Ack=1 Win=4288 Len=0 90:e2:ba:82:2c:7d -> 90:e2:ba:3e:a6:e8
219 2018-02-09 08:59:07.643343    10.10.2.1 -> 10.10.1.1    TCP 80→4234 [RST] Seq=1 Win=0 Len=0 90:e2:ba:3e:a6:e8 -> 90:e2:ba:82:2c:7d
220 2018-02-09 08:59:07.644786    10.10.1.1 -> 10.10.2.1    TCP 80→21031 [SYN, ACK] Seq=121525391 Ack=4903925 Win=16384 MSS=1460 90:e2:ba:82:2c:7d -> 90:e2:ba:3e:a6:e8
221 2018-02-09 08:59:07.646249    10.10.1.1 -> 10.10.2.1    TCP [TCP Dup ACK 46#2] 4835→8080 [ACK] Seq=1 Ack=1 Win=23360 Len=0 90:e2:ba:82:2c:7d -> 90:e2:ba:3e:a6:e8
222 2018-02-09 08:59:07.646345    10.10.2.1 -> 10.10.1.1    TCP 8080→4835 [RST] Seq=1 Win=0 Len=0 90:e2:ba:3e:a6:e8 -> 90:e2:ba:82:2c:7d
223 2018-02-09 08:59:07.647785    10.10.1.1 -> 10.10.2.1    TCP [TCP Dup ACK 99#1] 30737→80 [ACK] Seq=1 Ack=1 Win=64240 Len=0 90:e2:ba:82:2c:7d -> 90:e2:ba:3e:a6:e8
224 2018-02-09 08:59:07.647909    10.10.2.1 -> 10.10.1.1    TCP 80→30737 [RST] Seq=1 Win=0 Len=0 90:e2:ba:3e:a6:e8 -> 90:e2:ba:82:2c:7d
225 2018-02-09 08:59:07.712705    10.10.1.1 -> 10.10.2.1    TCP [TCP Retransmission] 80→3830 [ACK] Seq=1 Ack=1 Win=65535 Len=6 90:e2:ba:82:2c:7d -> 90:e2:ba:3e:a6:e8
226 2018-02-09 08:59:07.714749    10.10.1.1 -> 10.10.2.1    TCP 80→1570 [SYN, ACK] Seq=3124942518 Ack=3829827209 Win=17520 MSS=1460 90:e2:ba:82:2c:7d -> 90:e2:ba:3e:a6:e8
227 2018-02-09 08:59:07.716664    10.10.1.1 -> 10.10.2.1    TCP 80→34913 [ACK] Seq=1 Ack=1 Win=8576 Len=6 90:e2:ba:82:2c:7d -> 90:e2:ba:3e:a6:e8
228 2018-02-09 08:59:07.718666    10.10.1.1 -> 10.10.2.1    TCP [TCP Retransmission] 80→1077 [ACK] Seq=4294965837 Ack=1 Win=32120 Len=6 90:e2:ba:82:2c:7d -> 90:e2:ba:3e:a6:e8
229 2018-02-09 08:59:07.720548    10.10.1.1 -> 10.10.2.1    TCP [TCP Retransmission] 10322→1373 [PSH, ACK] Seq=1415 Ack=1 Win=9898 Len=6 90:e2:ba:82:2c:7d -> 90:e2:ba:3e:a6:e8
230 2018-02-09 08:59:07.722425    10.10.1.1 -> 10.10.2.1    TCP [TCP Retransmission] 80→20156 [ACK] Seq=4294966121 Ack=1 Win=33580 Len=6 90:e2:ba:82:2c:7d -> 90:e2:ba:3e:a6:e8
231 2018-02-09 08:59:07.724311    10.10.1.1 -> 10.10.2.1    TCP [TCP Retransmission] 80→1077 [PSH, ACK] Seq=1 Ack=1 Win=32120 Len=6 90:e2:ba:82:2c:7d -> 90:e2:ba:3e:a6:e8
232 2018-02-09 08:59:07.727364    10.10.1.1 -> 10.10.2.1    TCP [TCP Retransmission] 51253→80 [PSH, ACK] Seq=1 Ack=1 Win=32120 Len=6 90:e2:ba:82:2c:7d -> 90:e2:ba:3e:a6:e8
233 2018-02-09 08:59:07.729185    10.10.1.1 -> 10.10.2.1    TCP [TCP Retransmission] 10646→1469 [PSH, ACK] Seq=1 Ack=1 Win=9660 Len=6 90:e2:ba:82:2c:7d -> 90:e2:ba:3e:a6:e8
234 2018-02-09 08:59:07.730999    10.10.1.1 -> 10.10.2.1    TCP 8266→80 [FIN, ACK] Seq=1003409482 Ack=2273879807 Win=17520[Malformed Packet] 90:e2:ba:82:2c:7d -> 90:e2:ba:3e:a6:e8
235 2018-02-09 08:59:07.732806    10.10.1.1 -> 10.10.2.1    TCP [TCP Retransmission] 1055→80 [PSH, ACK] Seq=1 Ack=1 Win=8070 Len=6 90:e2:ba:82:2c:7d -> 90:e2:ba:3e:a6:e8
236 2018-02-09 08:59:07.734663    10.10.1.1 -> 10.10.2.1    TCP 8080→2102 [ACK] Seq=3143204609 Ack=1168230855 Win=17376[Malformed Packet] 90:e2:ba:82:2c:7d -> 90:e2:ba:3e:a6:e8
237 2018-02-09 08:59:07.736484    10.10.1.1 -> 10.10.2.1    TCP 80→21850 [SYN, ACK] Seq=2217835905 Ack=2303324095 Win=17520 MSS=1460 90:e2:ba:82:2c:7d -> 90:e2:ba:3e:a6:e8
238 2018-02-09 08:59:07.738331    10.10.1.1 -> 10.10.2.1    TCP [TCP Retransmission] 4656→6699 [PSH, ACK] Seq=1 Ack=1 Win=15557 Len=6 90:e2:ba:82:2c:7d -> 90:e2:ba:3e:a6:e8
239 2018-02-09 08:59:07.740085    10.10.1.1 -> 10.10.2.1    TCP [TCP Retransmission] 80→33670 [ACK] Seq=4294965837 Ack=1 Win=63832 Len=6 90:e2:ba:82:2c:7d -> 90:e2:ba:3e:a6:e8
240 2018-02-09 08:59:07.741843    10.10.1.1 -> 10.10.2.1    TCP [TCP Retransmission] 25→3561 [PSH, ACK] Seq=1 Ack=1 Win=17520 Len=6 90:e2:ba:82:2c:7d -> 90:e2:ba:3e:a6:e8
241 2018-02-09 08:59:07.743614    10.10.1.1 -> 10.10.2.1    TCP [TCP Previous segment not captured] 80→4514 [PSH, ACK] Seq=1461 Ack=1 Win=17130 Len=6 90:e2:ba:82:2c:7d -> 90:e2:ba:3e:a6:e8
242 2018-02-09 08:59:07.745324    10.10.1.1 -> 10.10.2.1    TCP 9949→80 [PSH, ACK] Seq=2201617779 Ack=3464876108 Win=17520[Malformed Packet] 90:e2:ba:82:2c:7d -> 90:e2:ba:3e:a6:e8
243 2018-02-09 08:59:07.747122    10.10.1.1 -> 10.10.2.1    TCP [TCP Retransmission] 80→3830 [ACK] Seq=1 Ack=1 Win=65535 Len=6 90:e2:ba:82:2c:7d -> 90:e2:ba:3e:a6:e8
244 2018-02-09 08:59:07.748891    10.10.1.1 -> 10.10.2.1    TCP [TCP Retransmission] 80→2194 [FIN, ACK] Seq=1 Ack=1 Win=16616 Len=0 90:e2:ba:82:2c:7d -> 90:e2:ba:3e:a6:e8
245 2018-02-09 08:59:07.749006    10.10.2.1 -> 10.10.1.1    TCP 2194→80 [RST] Seq=1 Win=0 Len=0 90:e2:ba:3e:a6:e8 -> 90:e2:ba:82:2c:7d
246 2018-02-09 08:59:07.750692    10.10.1.1 -> 10.10.2.1    TCP [TCP Retransmission] 10322→1373 [ACK] Seq=1 Ack=1 Win=9898 Len=6 90:e2:ba:82:2c:7d -> 90:e2:ba:3e:a6:e8
247 2018-02-09 08:59:07.752375    10.10.1.1 -> 10.10.2.1    TCP [TCP Retransmission] 8080→2075 [PSH, ACK] Seq=1 Ack=1 Win=32120 Len=6 90:e2:ba:82:2c:7d -> 90:e2:ba:3e:a6:e8
248 2018-02-09 08:59:07.754070    10.10.1.1 -> 10.10.2.1    TCP 12797→80 [FIN, ACK] Seq=252259445 Ack=3656396957 Win=33304[Malformed Packet] 90:e2:ba:82:2c:7d -> 90:e2:ba:3e:a6:e8
249 2018-02-09 08:59:07.755781    10.10.1.1 -> 10.10.2.1    TCP [TCP Retransmission] 10646→1469 [PSH, ACK] Seq=1 Ack=1 Win=9660 Len=6 90:e2:ba:82:2c:7d -> 90:e2:ba:3e:a6:e8
250 2018-02-09 08:59:07.757468    10.10.1.1 -> 10.10.2.1    TCP 48435→2612 [ACK] Seq=2065075984 Ack=2080017247 Win=63712[Malformed Packet] 90:e2:ba:82:2c:7d -> 90:e2:ba:3e:a6:e8
