  1 2018-02-09 08:58:44.074218    10.10.1.1 -> 10.10.2.1    TCP 2082→1214 [ACK] Seq=1 Ack=1 Win=17188 Len=6 90:e2:ba:82:2c:7d -> 90:e2:ba:3e:a6:e8
  2 2018-02-09 08:58:44.076555    10.10.1.1 -> 10.10.2.1    TCP 47302→80 [ACK] Seq=1394080085 Ack=3266262189 Win=17520[Malformed Packet] 90:e2:ba:82:2c:7d -> 90:e2:ba:3e:a6:e8
  3 2018-02-09 08:58:44.079954    10.10.1.1 -> 10.10.2.1    TCP 8266→80 [FIN, ACK] Seq=1003409482 Ack=2273879807 Win=17520[Malformed Packet] 90:e2:ba:82:2c:7d -> 90:e2:ba:3e:a6:e8
  4 2018-02-09 08:58:44.082677    10.10.1.1 -> 10.10.2.1    TCP 5762→80 [SYN] Seq=1851051921 Win=65535 MSS=1460 90:e2:ba:82:2c:7d -> 90:e2:ba:3e:a6:e8
  5 2018-02-09 08:58:44.085831    10.10.1.1 -> 10.10.2.1    TCP 10646→1469 [PSH, ACK] Seq=1 Ack=1 Win=9660 Len=6 90:e2:ba:82:2c:7d -> 90:e2:ba:3e:a6:e8
  6 2018-02-09 08:58:44.088764    10.10.1.1 -> 10.10.2.1    TCP 4945→80 [ACK] Seq=1 Ack=1 Win=8760 Len=0 90:e2:ba:82:2c:7d -> 90:e2:ba:3e:a6:e8
  7 2018-02-09 08:58:44.088852    10.10.2.1 -> 10.10.1.1    TCP 80→4945 [RST] Seq=1 Win=0 Len=0 90:e2:ba:3e:a6:e8 -> 90:e2:ba:82:2c:7d
  8 2018-02-09 08:58:44.091257    10.10.1.1 -> 10.10.2.1    TCP 80→2436 [ACK] Seq=1 Ack=1 Win=8460 Len=0 90:e2:ba:82:2c:7d -> 90:e2:ba:3e:a6:e8
  9 2018-02-09 08:58:44.091346    10.10.2.1 -> 10.10.1.1    TCP 2436→80 [RST] Seq=1 Win=0 Len=0 90:e2:ba:3e:a6:e8 -> 90:e2:ba:82:2c:7d
 10 2018-02-09 08:58:44.093534    10.10.1.1 -> 10.10.2.1    TCP 60024→80 [ACK] Seq=1 Ack=1 Win=8209 Len=0 90:e2:ba:82:2c:7d -> 90:e2:ba:3e:a6:e8
 11 2018-02-09 08:58:44.093625    10.10.2.1 -> 10.10.1.1    TCP 80→60024 [RST] Seq=1 Win=0 Len=0 90:e2:ba:3e:a6:e8 -> 90:e2:ba:82:2c:7d
 12 2018-02-09 08:58:44.095836    10.10.1.1 -> 10.10.2.1    TCP [TCP segment of a reassembled PDU] 90:e2:ba:82:2c:7d -> 90:e2:ba:3e:a6:e8
 13 2018-02-09 08:58:44.098380    10.10.1.1 -> 10.10.2.1    TCP 9941→80 [PSH, ACK] Seq=2199015092 Ack=2621007282 Win=17520[Malformed Packet] 90:e2:ba:82:2c:7d -> 90:e2:ba:3e:a6:e8
 14 2018-02-09 08:58:44.100204    10.10.1.1 -> 10.10.2.1    TCP 8478→63476 [PSH, ACK] Seq=1 Ack=1 Win=8760 Len=6 90:e2:ba:82:2c:7d -> 90:e2:ba:3e:a6:e8
 15 2018-02-09 08:58:44.102577    10.10.1.1 -> 10.10.2.1    TCP 80→4312 [SYN, ACK] Seq=0 Ack=1 Win=8760 Len=0 MSS=1460 90:e2:ba:82:2c:7d -> 90:e2:ba:3e:a6:e8
 16 2018-02-09 08:58:44.102664    10.10.2.1 -> 10.10.1.1    TCP 4312→80 [RST] Seq=1 Win=0 Len=0 90:e2:ba:3e:a6:e8 -> 90:e2:ba:82:2c:7d
 17 2018-02-09 08:58:44.104391    10.10.1.1 -> 10.10.2.1    TCP 80→46181 [PSH, ACK] Seq=1 Ack=1 Win=31504 Len=6 90:e2:ba:82:2c:7d -> 90:e2:ba:3e:a6:e8
 18 2018-02-09 08:58:44.106687    10.10.1.1 -> 10.10.2.1    TCP 80→2194 [FIN, ACK] Seq=1 Ack=1 Win=16616 Len=0 90:e2:ba:82:2c:7d -> 90:e2:ba:3e:a6:e8
 19 2018-02-09 08:58:44.106774    10.10.2.1 -> 10.10.1.1    TCP 2194→80 [RST] Seq=1 Win=0 Len=0 90:e2:ba:3e:a6:e8 -> 90:e2:ba:82:2c:7d
 20 2018-02-09 08:58:44.108620    10.10.1.1 -> 10.10.2.1    TCP [TCP Previous segment not captured] [TCP segment of a reassembled PDU] 90:e2:ba:82:2c:7d -> 90:e2:ba:3e:a6:e8
 21 2018-02-09 08:58:44.111181    10.10.1.1 -> 10.10.2.1    TCP [TCP segment of a reassembled PDU] 90:e2:ba:82:2c:7d -> 90:e2:ba:3e:a6:e8
 22 2018-02-09 08:58:44.113014    10.10.1.1 -> 10.10.2.1    TCP 10322→1373 [ACK] Seq=1 Ack=1 Win=9898 Len=6 90:e2:ba:82:2c:7d -> 90:e2:ba:3e:a6:e8
 23 2018-02-09 08:58:44.115041    10.10.1.1 -> 10.10.2.1    TCP 2671→8080 [ACK] Seq=1 Ack=1 Win=8760 Len=0 90:e2:ba:82:2c:7d -> 90:e2:ba:3e:a6:e8
 24 2018-02-09 08:58:44.115129    10.10.2.1 -> 10.10.1.1    TCP 8080→2671 [RST] Seq=1 Win=0 Len=0 90:e2:ba:3e:a6:e8 -> 90:e2:ba:82:2c:7d
 25 2018-02-09 08:58:44.116918    10.10.1.1 -> 10.10.2.1    TCP 51254→80 [ACK] Seq=1 Ack=1 Win=32120 Len=0 90:e2:ba:82:2c:7d -> 90:e2:ba:3e:a6:e8
 26 2018-02-09 08:58:44.117008    10.10.2.1 -> 10.10.1.1    TCP 80→51254 [RST] Seq=1 Win=0 Len=0 90:e2:ba:3e:a6:e8 -> 90:e2:ba:82:2c:7d
 27 2018-02-09 08:58:44.118798    10.10.1.1 -> 10.10.2.1    TCP [TCP segment of a reassembled PDU] 90:e2:ba:82:2c:7d -> 90:e2:ba:3e:a6:e8
 28 2018-02-09 08:58:44.120694    10.10.1.1 -> 10.10.2.1    TCP [TCP Retransmission] 2082→1214 [ACK] Seq=1 Ack=1 Win=17188 Len=6 90:e2:ba:82:2c:7d -> 90:e2:ba:3e:a6:e8
 29 2018-02-09 08:58:44.122471    10.10.1.1 -> 10.10.2.1    TCP 47302→80 [ACK] Seq=1394080085 Ack=3266262189 Win=17520[Malformed Packet] 90:e2:ba:82:2c:7d -> 90:e2:ba:3e:a6:e8
 30 2018-02-09 08:58:44.124106    10.10.1.1 -> 10.10.2.1    TCP [TCP Retransmission] 10646→1469 [PSH, ACK] Seq=1 Ack=1 Win=9660 Len=6 90:e2:ba:82:2c:7d -> 90:e2:ba:3e:a6:e8
 31 2018-02-09 08:58:44.125756    10.10.1.1 -> 10.10.2.1    TCP [TCP Retransmission] 10646→1469 [ACK] Seq=4294965917 Ack=1 Win=9660 Len=6 90:e2:ba:82:2c:7d -> 90:e2:ba:3e:a6:e8
 32 2018-02-09 08:58:44.127639    10.10.1.1 -> 10.10.2.1    TCP [TCP Retransmission] 10646→1469 [ACK] Seq=4294964826 Ack=1 Win=9660 Len=6 90:e2:ba:82:2c:7d -> 90:e2:ba:3e:a6:e8
 33 2018-02-09 08:58:44.129352    10.10.1.1 -> 10.10.2.1    TCP 1755→35451 [ACK] Seq=1 Ack=1 Win=16224 Len=6 90:e2:ba:82:2c:7d -> 90:e2:ba:3e:a6:e8
 34 2018-02-09 08:58:44.131116    10.10.1.1 -> 10.10.2.1    TCP 48435→2612 [ACK] Seq=2065075984 Ack=2080017247 Win=63712[Malformed Packet] 90:e2:ba:82:2c:7d -> 90:e2:ba:3e:a6:e8
 35 2018-02-09 08:58:44.133090    10.10.1.1 -> 10.10.2.1    TCP 51253→80 [ACK] Seq=1 Ack=1 Win=32120 Len=0 90:e2:ba:82:2c:7d -> 90:e2:ba:3e:a6:e8
 36 2018-02-09 08:58:44.133174    10.10.2.1 -> 10.10.1.1    TCP 80→51253 [RST] Seq=1 Win=0 Len=0 90:e2:ba:3e:a6:e8 -> 90:e2:ba:82:2c:7d
 37 2018-02-09 08:58:44.134654    10.10.1.1 -> 10.10.2.1    TCP 1059→80 [ACK] Seq=1 Ack=1 Win=8484 Len=0 90:e2:ba:82:2c:7d -> 90:e2:ba:3e:a6:e8
 38 2018-02-09 08:58:44.134740    10.10.2.1 -> 10.10.1.1    TCP 80→1059 [RST] Seq=1 Win=0 Len=0 90:e2:ba:3e:a6:e8 -> 90:e2:ba:82:2c:7d
 39 2018-02-09 08:58:44.136454    10.10.1.1 -> 10.10.2.1    TCP 80→21850 [SYN, ACK] Seq=2217835905 Ack=2303324095 Win=17520 MSS=1460 90:e2:ba:82:2c:7d -> 90:e2:ba:3e:a6:e8
 40 2018-02-09 08:58:44.138115    10.10.1.1 -> 10.10.2.1    TCP 60024→80 [FIN, ACK] Seq=3085108199 Ack=4093544958 Win=17520[Malformed Packet] 90:e2:ba:82:2c:7d -> 90:e2:ba:3e:a6:e8
 41 2018-02-09 08:58:44.140081    10.10.1.1 -> 10.10.2.1    TCP 48901→80 [ACK] Seq=1 Ack=1 Win=46720 Len=0 90:e2:ba:82:2c:7d -> 90:e2:ba:3e:a6:e8
 42 2018-02-09 08:58:44.140172    10.10.2.1 -> 10.10.1.1    TCP 80→48901 [RST] Seq=1 Win=0 Len=0 90:e2:ba:3e:a6:e8 -> 90:e2:ba:82:2c:7d
 43 2018-02-09 08:58:44.142275    10.10.1.1 -> 10.10.2.1    TCP [TCP segment of a reassembled PDU] 90:e2:ba:82:2c:7d -> 90:e2:ba:3e:a6:e8
 44 2018-02-09 08:58:44.144408    10.10.1.1 -> 10.10.2.1    UDP Source port: 28800  Destination port: 28800 90:e2:ba:82:2c:7d -> 90:e2:ba:3e:a6:e8
 45 2018-02-09 08:58:44.144504    10.10.2.1 -> 10.10.1.1    ICMP Destination unreachable (Port unreachable) 90:e2:ba:3e:a6:e8 -> 90:e2:ba:82:2c:7d
 46 2018-02-09 08:58:44.146577    10.10.1.1 -> 10.10.2.1    TCP 80→21031 [SYN, ACK] Seq=121525391 Ack=4903925 Win=16384 MSS=1460 90:e2:ba:82:2c:7d -> 90:e2:ba:3e:a6:e8
 47 2018-02-09 08:58:44.148835    10.10.1.1 -> 10.10.2.1    TCP 43980→25 [RST] Seq=1 Win=0 Len=0 90:e2:ba:82:2c:7d -> 90:e2:ba:3e:a6:e8
 48 2018-02-09 08:58:44.151056    10.10.1.1 -> 10.10.2.1    TCP [TCP segment of a reassembled PDU] 90:e2:ba:82:2c:7d -> 90:e2:ba:3e:a6:e8
 49 2018-02-09 08:58:44.152880    10.10.1.1 -> 10.10.2.1    TCP 40875→1214 [PSH, ACK] Seq=1 Ack=1 Win=16968 Len=6 90:e2:ba:82:2c:7d -> 90:e2:ba:3e:a6:e8
 50 2018-02-09 08:58:44.155133    10.10.1.1 -> 10.10.2.1    TCP [TCP segment of a reassembled PDU] 90:e2:ba:82:2c:7d -> 90:e2:ba:3e:a6:e8
 51 2018-02-09 08:58:44.156653    10.10.1.1 -> 10.10.2.1    TCP [TCP Retransmission] 8478→63476 [PSH, ACK] Seq=1 Ack=1 Win=8760 Len=6 90:e2:ba:82:2c:7d -> 90:e2:ba:3e:a6:e8
 52 2018-02-09 08:58:44.158466    10.10.1.1 -> 10.10.2.1    TCP [TCP Retransmission] 80→46181 [PSH, ACK] Seq=1 Ack=1 Win=31504 Len=6 90:e2:ba:82:2c:7d -> 90:e2:ba:3e:a6:e8
 53 2018-02-09 08:58:44.160444    10.10.1.1 -> 10.10.2.1    TCP 9941→80 [ACK] Seq=2199015092 Ack=2621007282 Win=17520[Malformed Packet] 90:e2:ba:82:2c:7d -> 90:e2:ba:3e:a6:e8
 54 2018-02-09 08:58:44.162574    10.10.1.1 -> 10.10.2.1    TCP 80→3016 [ACK] Seq=1 Ack=1 Win=8760 Len=6 90:e2:ba:82:2c:7d -> 90:e2:ba:3e:a6:e8
 55 2018-02-09 08:58:44.164558    10.10.1.1 -> 10.10.2.1    TCP [TCP Retransmission] 80→2194 [FIN, ACK] Seq=1 Ack=1 Win=16616 Len=0 90:e2:ba:82:2c:7d -> 90:e2:ba:3e:a6:e8
 56 2018-02-09 08:58:44.164646    10.10.2.1 -> 10.10.1.1    TCP 2194→80 [RST] Seq=1 Win=0 Len=0 90:e2:ba:3e:a6:e8 -> 90:e2:ba:82:2c:7d
 57 2018-02-09 08:58:44.166645    10.10.1.1 -> 10.10.2.1    TCP 47091→80 [ACK] Seq=2992269940 Ack=4290529155 Win=17520[Malformed Packet] 90:e2:ba:82:2c:7d -> 90:e2:ba:3e:a6:e8
 58 2018-02-09 08:58:44.168236    10.10.1.1 -> 10.10.2.1    TCP 80→49365 [PSH, ACK] Seq=3931780319 Ack=3608251601 Win=17135[Malformed Packet] 90:e2:ba:82:2c:7d -> 90:e2:ba:3e:a6:e8
 59 2018-02-09 08:58:44.170738    10.10.1.1 -> 10.10.2.1    TCP [TCP segment of a reassembled PDU] 90:e2:ba:82:2c:7d -> 90:e2:ba:3e:a6:e8
 60 2018-02-09 08:58:44.173156    10.10.1.1 -> 10.10.2.1    TCP 1053→49540 [ACK] Seq=1 Ack=1 Win=8760 Len=6 90:e2:ba:82:2c:7d -> 90:e2:ba:3e:a6:e8
 61 2018-02-09 08:58:44.175891    10.10.1.1 -> 10.10.2.1    TCP [TCP Dup ACK 23#1] 2671→8080 [ACK] Seq=1 Ack=1 Win=8760 Len=0 90:e2:ba:82:2c:7d -> 90:e2:ba:3e:a6:e8
 62 2018-02-09 08:58:44.175979    10.10.2.1 -> 10.10.1.1    TCP 8080→2671 [RST] Seq=1 Win=0 Len=0 90:e2:ba:3e:a6:e8 -> 90:e2:ba:82:2c:7d
 63 2018-02-09 08:58:44.178103    10.10.1.1 -> 10.10.2.1    TCP 12797→80 [FIN, ACK] Seq=252259445 Ack=3656396957 Win=33304[Malformed Packet] 90:e2:ba:82:2c:7d -> 90:e2:ba:3e:a6:e8
 64 2018-02-09 08:58:44.180044    10.10.1.1 -> 10.10.2.1    TCP [TCP Retransmission] 2082→1214 [ACK] Seq=1 Ack=1 Win=17188 Len=6 90:e2:ba:82:2c:7d -> 90:e2:ba:3e:a6:e8
 65 2018-02-09 08:58:44.182242    10.10.1.1 -> 10.10.2.1    TCP 47302→80 [ACK] Seq=1394080085 Ack=3266262189 Win=17520[Malformed Packet] 90:e2:ba:82:2c:7d -> 90:e2:ba:3e:a6:e8
 66 2018-02-09 08:58:44.184172    10.10.1.1 -> 10.10.2.1    TCP [TCP Retransmission] 10646→1469 [PSH, ACK] Seq=1 Ack=1 Win=9660 Len=6 90:e2:ba:82:2c:7d -> 90:e2:ba:3e:a6:e8
 67 2018-02-09 08:58:44.186259    10.10.1.1 -> 10.10.2.1    TCP [TCP Dup ACK 8#1] 80→2436 [ACK] Seq=1 Ack=1 Win=8460 Len=0 90:e2:ba:82:2c:7d -> 90:e2:ba:3e:a6:e8
 68 2018-02-09 08:58:44.186344    10.10.2.1 -> 10.10.1.1    TCP 2436→80 [RST] Seq=1 Win=0 Len=0 90:e2:ba:3e:a6:e8 -> 90:e2:ba:82:2c:7d
 69 2018-02-09 08:58:44.188059    10.10.1.1 -> 10.10.2.1    TCP 8266→80 [FIN, ACK] Seq=1003409482 Ack=2273879807 Win=17520[Malformed Packet] 90:e2:ba:82:2c:7d -> 90:e2:ba:3e:a6:e8
 70 2018-02-09 08:58:44.189615    10.10.1.1 -> 10.10.2.1    TCP 48435→2612 [ACK] Seq=2065075984 Ack=2080017247 Win=63712[Malformed Packet] 90:e2:ba:82:2c:7d -> 90:e2:ba:3e:a6:e8
 71 2018-02-09 08:58:44.191426    10.10.1.1 -> 10.10.2.1    TCP [TCP segment of a reassembled PDU] 90:e2:ba:82:2c:7d -> 90:e2:ba:3e:a6:e8
 72 2018-02-09 08:58:44.193474    10.10.1.1 -> 10.10.2.1    TCP [TCP Dup ACK 35#1] 51253→80 [ACK] Seq=1 Ack=1 Win=32120 Len=0 90:e2:ba:82:2c:7d -> 90:e2:ba:3e:a6:e8
 73 2018-02-09 08:58:44.193560    10.10.2.1 -> 10.10.1.1    TCP 80→51253 [RST] Seq=1 Win=0 Len=0 90:e2:ba:3e:a6:e8 -> 90:e2:ba:82:2c:7d
 74 2018-02-09 08:58:44.195483    10.10.1.1 -> 10.10.2.1    TCP 80→65119 [PSH, ACK] Seq=1 Ack=1 Win=8760 Len=6 90:e2:ba:82:2c:7d -> 90:e2:ba:3e:a6:e8
 75 2018-02-09 08:58:44.197489    10.10.1.1 -> 10.10.2.1    TCP 60024→80 [FIN, ACK] Seq=3085108199 Ack=4093544958 Win=17520[Malformed Packet] 90:e2:ba:82:2c:7d -> 90:e2:ba:3e:a6:e8
 76 2018-02-09 08:58:44.198917    10.10.1.1 -> 10.10.2.1    TCP 4656→6699 [PSH, ACK] Seq=1 Ack=1 Win=15557 Len=6 90:e2:ba:82:2c:7d -> 90:e2:ba:3e:a6:e8
 77 2018-02-09 08:58:44.201343    10.10.1.1 -> 10.10.2.1    TCP [TCP Retransmission] 80→33670 [PSH, ACK] Seq=1 Ack=1 Win=63832 Len=6 90:e2:ba:82:2c:7d -> 90:e2:ba:3e:a6:e8
 78 2018-02-09 08:58:44.203584    10.10.1.1 -> 10.10.2.1    TCP 80→21031 [SYN, ACK] Seq=121525391 Ack=4903925 Win=16384 MSS=1460 90:e2:ba:82:2c:7d -> 90:e2:ba:3e:a6:e8
 79 2018-02-09 08:58:44.205651    10.10.1.1 -> 10.10.2.1    TCP 1322→80 [RST] Seq=1 Win=0 Len=0 90:e2:ba:82:2c:7d -> 90:e2:ba:3e:a6:e8
 80 2018-02-09 08:58:44.207877    10.10.1.1 -> 10.10.2.1    TCP 4835→8080 [ACK] Seq=1 Ack=1 Win=23360 Len=0 90:e2:ba:82:2c:7d -> 90:e2:ba:3e:a6:e8
 81 2018-02-09 08:58:44.207962    10.10.2.1 -> 10.10.1.1    TCP 8080→4835 [RST] Seq=1 Win=0 Len=0 90:e2:ba:3e:a6:e8 -> 90:e2:ba:82:2c:7d
 82 2018-02-09 08:58:44.210106    10.10.1.1 -> 10.10.2.1    TCP [TCP Retransmission] [TCP segment of a reassembled PDU] 90:e2:ba:82:2c:7d -> 90:e2:ba:3e:a6:e8
 83 2018-02-09 08:58:44.211708    10.10.1.1 -> 10.10.2.1    TCP [TCP Retransmission] 80→1728 [PSH, ACK] Seq=1 Ack=1 Win=32522 Len=6 90:e2:ba:82:2c:7d -> 90:e2:ba:3e:a6:e8
 84 2018-02-09 08:58:44.213004    10.10.1.1 -> 10.10.2.1    UDP Source port: 14310  Destination port: 39012 [BAD UDP LENGTH 44 > IP PAYLOAD LENGTH] 90:e2:ba:82:2c:7d -> 90:e2:ba:3e:a6:e8
 85 2018-02-09 08:58:44.214420    10.10.1.1 -> 10.10.2.1    TCP 30737→80 [ACK] Seq=1 Ack=1 Win=64240 Len=0 90:e2:ba:82:2c:7d -> 90:e2:ba:3e:a6:e8
 86 2018-02-09 08:58:44.214507    10.10.2.1 -> 10.10.1.1    TCP 80→30737 [RST] Seq=1 Win=0 Len=0 90:e2:ba:3e:a6:e8 -> 90:e2:ba:82:2c:7d
 87 2018-02-09 08:58:44.216256    10.10.1.1 -> 10.10.2.1    TCP [TCP Retransmission] 80→46181 [PSH, ACK] Seq=1 Ack=1 Win=31504 Len=6 90:e2:ba:82:2c:7d -> 90:e2:ba:3e:a6:e8
 88 2018-02-09 08:58:44.218232    10.10.1.1 -> 10.10.2.1    TCP 80→1570 [SYN, ACK] Seq=3124942518 Ack=3829827209 Win=17520 MSS=1460 90:e2:ba:82:2c:7d -> 90:e2:ba:3e:a6:e8
 89 2018-02-09 08:58:44.219859    10.10.1.1 -> 10.10.2.1    DNS Standard query response 0xe400 [Malformed Packet] 90:e2:ba:82:2c:7d -> 90:e2:ba:3e:a6:e8
 90 2018-02-09 08:58:44.221611    10.10.1.1 -> 10.10.2.1    TCP 47091→80 [ACK] Seq=2992269940 Ack=4290529155 Win=17520[Malformed Packet] 90:e2:ba:82:2c:7d -> 90:e2:ba:3e:a6:e8
 91 2018-02-09 08:58:44.223516    10.10.1.1 -> 10.10.2.1    TCP 64789→80 [ACK] Seq=1 Ack=1 Win=65340 Len=0 90:e2:ba:82:2c:7d -> 90:e2:ba:3e:a6:e8
 92 2018-02-09 08:58:44.223604    10.10.2.1 -> 10.10.1.1    TCP 80→64789 [RST] Seq=1 Win=0 Len=0 90:e2:ba:3e:a6:e8 -> 90:e2:ba:82:2c:7d
 93 2018-02-09 08:58:44.226058    10.10.1.1 -> 10.10.2.1    TCP [TCP Retransmission] 10322→1373 [ACK] Seq=1 Ack=1 Win=9898 Len=6 90:e2:ba:82:2c:7d -> 90:e2:ba:3e:a6:e8
 94 2018-02-09 08:58:44.228134    10.10.1.1 -> 10.10.2.1    TCP [TCP Previous segment not captured] [TCP segment of a reassembled PDU] 90:e2:ba:82:2c:7d -> 90:e2:ba:3e:a6:e8
 95 2018-02-09 08:58:44.230266    10.10.1.1 -> 10.10.2.1    UDP Source port: 4628  Destination port: 3184 [BAD UDP LENGTH 1264 > IP PAYLOAD LENGTH] 90:e2:ba:82:2c:7d -> 90:e2:ba:3e:a6:e8
 96 2018-02-09 08:58:44.232724    10.10.1.1 -> 10.10.2.1    TCP [TCP Dup ACK 23#2] 2671→8080 [ACK] Seq=1 Ack=1 Win=8760 Len=0 90:e2:ba:82:2c:7d -> 90:e2:ba:3e:a6:e8
 97 2018-02-09 08:58:44.232815    10.10.2.1 -> 10.10.1.1    TCP 8080→2671 [RST] Seq=1 Win=0 Len=0 90:e2:ba:3e:a6:e8 -> 90:e2:ba:82:2c:7d
 98 2018-02-09 08:58:44.235169    10.10.1.1 -> 10.10.2.1    TCP [TCP Retransmission] 2082→1214 [ACK] Seq=1 Ack=1 Win=17188 Len=6 90:e2:ba:82:2c:7d -> 90:e2:ba:3e:a6:e8
 99 2018-02-09 08:58:44.237397    10.10.1.1 -> 10.10.2.1    TCP 47302→80 [ACK] Seq=1394080085 Ack=3266262189 Win=17520[Malformed Packet] 90:e2:ba:82:2c:7d -> 90:e2:ba:3e:a6:e8
100 2018-02-09 08:58:44.239005    10.10.1.1 -> 10.10.2.1    TCP [TCP Retransmission] 10646→1469 [PSH, ACK] Seq=1 Ack=1 Win=9660 Len=6 90:e2:ba:82:2c:7d -> 90:e2:ba:3e:a6:e8
101 2018-02-09 08:58:44.241027    10.10.1.1 -> 10.10.2.1    TCP [TCP Dup ACK 25#1] 51254→80 [ACK] Seq=1 Ack=1 Win=32120 Len=0 90:e2:ba:82:2c:7d -> 90:e2:ba:3e:a6:e8
102 2018-02-09 08:58:44.241110    10.10.2.1 -> 10.10.1.1    TCP 80→51254 [RST] Seq=1 Win=0 Len=0 90:e2:ba:3e:a6:e8 -> 90:e2:ba:82:2c:7d
103 2018-02-09 08:58:44.243407    10.10.1.1 -> 10.10.2.1    TCP [TCP segment of a reassembled PDU] 90:e2:ba:82:2c:7d -> 90:e2:ba:3e:a6:e8
104 2018-02-09 08:58:44.245734    10.10.1.1 -> 10.10.2.1    UDP Source port: 12203  Destination port: 12203 [BAD UDP LENGTH 85 > IP PAYLOAD LENGTH] 90:e2:ba:82:2c:7d -> 90:e2:ba:3e:a6:e8
105 2018-02-09 08:58:44.247920    10.10.1.1 -> 10.10.2.1    TCP [TCP Retransmission] 1055→80 [PSH, ACK] Seq=1 Ack=1 Win=8070 Len=6 90:e2:ba:82:2c:7d -> 90:e2:ba:3e:a6:e8
106 2018-02-09 08:58:44.250421    10.10.1.1 -> 10.10.2.1    TCP [TCP Dup ACK 10#1] 60024→80 [ACK] Seq=1 Ack=1 Win=8209 Len=0 90:e2:ba:82:2c:7d -> 90:e2:ba:3e:a6:e8
107 2018-02-09 08:58:44.250510    10.10.2.1 -> 10.10.1.1    TCP 80→60024 [RST] Seq=1 Win=0 Len=0 90:e2:ba:3e:a6:e8 -> 90:e2:ba:82:2c:7d
108 2018-02-09 08:58:44.252398    10.10.1.1 -> 10.10.2.1    TCP 8080→2102 [ACK] Seq=3143204609 Ack=1168230855 Win=17376[Malformed Packet] 90:e2:ba:82:2c:7d -> 90:e2:ba:3e:a6:e8
109 2018-02-09 08:58:44.254374    10.10.1.1 -> 10.10.2.1    TCP 80→21850 [SYN, ACK] Seq=2217835905 Ack=2303324095 Win=17520 MSS=1460 90:e2:ba:82:2c:7d -> 90:e2:ba:3e:a6:e8
110 2018-02-09 08:58:44.256265    10.10.1.1 -> 10.10.2.1    TCP 1755→3539 [PSH, ACK] Seq=1 Ack=1 Win=16080 Len=6 90:e2:ba:82:2c:7d -> 90:e2:ba:3e:a6:e8
111 2018-02-09 08:58:44.258273    10.10.1.1 -> 10.10.2.1    TCP 1060→6699 [PSH, ACK] Seq=1 Ack=1 Win=17520 Len=6 90:e2:ba:82:2c:7d -> 90:e2:ba:3e:a6:e8
112 2018-02-09 08:58:44.260321    10.10.1.1 -> 10.10.2.1    TCP 4662→65158 [ACK] Seq=1 Ack=1 Win=64635 Len=0 90:e2:ba:82:2c:7d -> 90:e2:ba:3e:a6:e8
113 2018-02-09 08:58:44.260408    10.10.2.1 -> 10.10.1.1    TCP 65158→4662 [RST] Seq=1 Win=0 Len=0 90:e2:ba:3e:a6:e8 -> 90:e2:ba:82:2c:7d
114 2018-02-09 08:58:44.262539    10.10.1.1 -> 10.10.2.1    TCP 4234→80 [ACK] Seq=1 Ack=1 Win=4288 Len=0 90:e2:ba:82:2c:7d -> 90:e2:ba:3e:a6:e8
115 2018-02-09 08:58:44.262624    10.10.2.1 -> 10.10.1.1    TCP 80→4234 [RST] Seq=1 Win=0 Len=0 90:e2:ba:3e:a6:e8 -> 90:e2:ba:82:2c:7d
116 2018-02-09 08:58:44.264754    10.10.1.1 -> 10.10.2.1    TCP [TCP Retransmission] [TCP segment of a reassembled PDU] 90:e2:ba:82:2c:7d -> 90:e2:ba:3e:a6:e8
117 2018-02-09 08:58:44.266854    10.10.1.1 -> 10.10.2.1    TCP 25→3965 [PSH, ACK] Seq=369485957 Ack=1543290807 Win=8908[Malformed Packet] 90:e2:ba:82:2c:7d -> 90:e2:ba:3e:a6:e8
118 2018-02-09 08:58:44.268800    10.10.1.1 -> 10.10.2.1    TCP [TCP Retransmission] 25→3561 [PSH, ACK] Seq=1 Ack=1 Win=17520 Len=6 90:e2:ba:82:2c:7d -> 90:e2:ba:3e:a6:e8
119 2018-02-09 08:58:44.270650    10.10.1.1 -> 10.10.2.1    TCP [TCP Retransmission] 80→46181 [PSH, ACK] Seq=4294965865 Ack=1 Win=31504 Len=6 90:e2:ba:82:2c:7d -> 90:e2:ba:3e:a6:e8
120 2018-02-09 08:58:44.272342    10.10.1.1 -> 10.10.2.1    TCP [TCP Retransmission] 80→1728 [PSH, ACK] Seq=1 Ack=1 Win=32522 Len=6 90:e2:ba:82:2c:7d -> 90:e2:ba:3e:a6:e8
121 2018-02-09 08:58:44.274524    10.10.1.1 -> 10.10.2.1    UDP Source port: 14310  Destination port: 39012 [BAD UDP LENGTH 44 > IP PAYLOAD LENGTH] 90:e2:ba:82:2c:7d -> 90:e2:ba:3e:a6:e8
122 2018-02-09 08:58:44.276540    10.10.1.1 -> 10.10.2.1    TCP [TCP Retransmission] 8478→63476 [PSH, ACK] Seq=1 Ack=1 Win=8760 Len=6 90:e2:ba:82:2c:7d -> 90:e2:ba:3e:a6:e8
123 2018-02-09 08:58:44.278315    10.10.1.1 -> 10.10.2.1    TCP [TCP Retransmission] 80→46181 [PSH, ACK] Seq=1 Ack=1 Win=31504 Len=6 90:e2:ba:82:2c:7d -> 90:e2:ba:3e:a6:e8
124 2018-02-09 08:58:44.280245    10.10.1.1 -> 10.10.2.1    TCP 9949→80 [PSH, ACK] Seq=2201617779 Ack=3464876108 Win=17520[Malformed Packet] 90:e2:ba:82:2c:7d -> 90:e2:ba:3e:a6:e8
125 2018-02-09 08:58:44.282451    10.10.1.1 -> 10.10.2.1    TCP 80→1570 [SYN, ACK] Seq=3124942518 Ack=3829827209 Win=17520 MSS=1460 90:e2:ba:82:2c:7d -> 90:e2:ba:3e:a6:e8
126 2018-02-09 08:58:44.284230    10.10.1.1 -> 10.10.2.1    TCP [TCP Retransmission] 80→3016 [ACK] Seq=1 Ack=1 Win=8760 Len=6 90:e2:ba:82:2c:7d -> 90:e2:ba:3e:a6:e8
127 2018-02-09 08:58:44.286195    10.10.1.1 -> 10.10.2.1    TCP 47091→80 [ACK] Seq=2992269940 Ack=4290529155 Win=17520[Malformed Packet] 90:e2:ba:82:2c:7d -> 90:e2:ba:3e:a6:e8
128 2018-02-09 08:58:44.287930    10.10.1.1 -> 10.10.2.1    TCP [TCP Retransmission] 10322→1373 [ACK] Seq=1 Ack=1 Win=9898 Len=6 90:e2:ba:82:2c:7d -> 90:e2:ba:3e:a6:e8
129 2018-02-09 08:58:44.289817    10.10.1.1 -> 10.10.2.1    TCP [TCP Previous segment not captured] 10322→1373 [PSH, ACK] Seq=2829 Ack=1 Win=9898 Len=6 90:e2:ba:82:2c:7d -> 90:e2:ba:3e:a6:e8
130 2018-02-09 08:58:44.291670    10.10.1.1 -> 10.10.2.1    TCP [TCP Dup ACK 23#3] 2671→8080 [ACK] Seq=1 Ack=1 Win=8760 Len=0 90:e2:ba:82:2c:7d -> 90:e2:ba:3e:a6:e8
131 2018-02-09 08:58:44.291755    10.10.2.1 -> 10.10.1.1    TCP 8080→2671 [RST] Seq=1 Win=0 Len=0 90:e2:ba:3e:a6:e8 -> 90:e2:ba:82:2c:7d
132 2018-02-09 08:58:44.293542    10.10.1.1 -> 10.10.2.1    TCP [TCP Dup ACK 25#2] 51254→80 [ACK] Seq=1 Ack=1 Win=32120 Len=0 90:e2:ba:82:2c:7d -> 90:e2:ba:3e:a6:e8
133 2018-02-09 08:58:44.293629    10.10.2.1 -> 10.10.1.1    TCP 80→51254 [RST] Seq=1 Win=0 Len=0 90:e2:ba:3e:a6:e8 -> 90:e2:ba:82:2c:7d
134 2018-02-09 08:58:44.295442    10.10.1.1 -> 10.10.2.1    TCP [TCP Retransmission] 80→41084 [ACK] Seq=1 Ack=1 Win=16126 Len=6 90:e2:ba:82:2c:7d -> 90:e2:ba:3e:a6:e8
135 2018-02-09 08:58:44.297163    10.10.1.1 -> 10.10.2.1    TCP [TCP Retransmission] 10646→1469 [PSH, ACK] Seq=1 Ack=1 Win=9660 Len=6 90:e2:ba:82:2c:7d -> 90:e2:ba:3e:a6:e8
136 2018-02-09 08:58:44.298776    10.10.1.1 -> 10.10.2.1    TCP [TCP Retransmission] 10646→1469 [ACK] Seq=4294965917 Ack=1 Win=9660 Len=6 90:e2:ba:82:2c:7d -> 90:e2:ba:3e:a6:e8
137 2018-02-09 08:58:44.300420    10.10.1.1 -> 10.10.2.1    UDP Source port: 1716  Destination port: 2707 [BAD UDP LENGTH 45 > IP PAYLOAD LENGTH] 90:e2:ba:82:2c:7d -> 90:e2:ba:3e:a6:e8
138 2018-02-09 08:58:44.302301    10.10.1.1 -> 10.10.2.1    TCP [TCP Previous segment not captured] 1755→35451 [PSH, ACK] Seq=1461 Ack=1 Win=16224 Len=6 90:e2:ba:82:2c:7d -> 90:e2:ba:3e:a6:e8
139 2018-02-09 08:58:44.304061    10.10.1.1 -> 10.10.2.1    UDP Source port: 6003  Destination port: 6003 [BAD UDP LENGTH 122 > IP PAYLOAD LENGTH] 90:e2:ba:82:2c:7d -> 90:e2:ba:3e:a6:e8
140 2018-02-09 08:58:44.305738    10.10.1.1 -> 10.10.2.1    TCP 51253→80 [ACK] Seq=1 Ack=1 Win=32120 Len=0 90:e2:ba:82:2c:7d -> 90:e2:ba:3e:a6:e8
141 2018-02-09 08:58:44.305825    10.10.2.1 -> 10.10.1.1    TCP 80→51253 [RST] Seq=1 Win=0 Len=0 90:e2:ba:3e:a6:e8 -> 90:e2:ba:82:2c:7d
142 2018-02-09 08:58:44.307361    10.10.1.1 -> 10.10.2.1    TCP [TCP Previous segment not captured] [TCP segment of a reassembled PDU] 90:e2:ba:82:2c:7d -> 90:e2:ba:3e:a6:e8
143 2018-02-09 08:58:44.309042    10.10.1.1 -> 10.10.2.1    TCP 80→21850 [SYN, ACK] Seq=2217835905 Ack=2303324095 Win=17520 MSS=1460 90:e2:ba:82:2c:7d -> 90:e2:ba:3e:a6:e8
144 2018-02-09 08:58:44.310839    10.10.1.1 -> 10.10.2.1    TCP [TCP Retransmission] 1755→3539 [PSH, ACK] Seq=1 Ack=1 Win=16080 Len=6 90:e2:ba:82:2c:7d -> 90:e2:ba:3e:a6:e8
145 2018-02-09 08:58:44.312254    10.10.1.1 -> 10.10.2.1    TCP [TCP Dup ACK 112#1] 4662→65158 [ACK] Seq=1 Ack=1 Win=64635 Len=0 90:e2:ba:82:2c:7d -> 90:e2:ba:3e:a6:e8
146 2018-02-09 08:58:44.312337    10.10.2.1 -> 10.10.1.1    TCP 65158→4662 [RST] Seq=1 Win=0 Len=0 90:e2:ba:3e:a6:e8 -> 90:e2:ba:82:2c:7d
147 2018-02-09 08:58:44.313696    10.10.1.1 -> 10.10.2.1    TCP [TCP Dup ACK 114#1] 4234→80 [ACK] Seq=1 Ack=1 Win=4288 Len=0 90:e2:ba:82:2c:7d -> 90:e2:ba:3e:a6:e8
148 2018-02-09 08:58:44.313782    10.10.2.1 -> 10.10.1.1    TCP 80→4234 [RST] Seq=1 Win=0 Len=0 90:e2:ba:3e:a6:e8 -> 90:e2:ba:82:2c:7d
149 2018-02-09 08:58:44.315261    10.10.1.1 -> 10.10.2.1    UDP Source port: 28800  Destination port: 28800 90:e2:ba:82:2c:7d -> 90:e2:ba:3e:a6:e8
150 2018-02-09 08:58:44.315349    10.10.2.1 -> 10.10.1.1    ICMP Destination unreachable (Port unreachable) 90:e2:ba:3e:a6:e8 -> 90:e2:ba:82:2c:7d
151 2018-02-09 08:58:44.316691    10.10.1.1 -> 10.10.2.1    TCP [TCP Retransmission] 80→33670 [ACK] Seq=4294965837 Ack=1 Win=63832 Len=6 90:e2:ba:82:2c:7d -> 90:e2:ba:3e:a6:e8
152 2018-02-09 08:58:44.318139    10.10.1.1 -> 10.10.2.1    TCP 25→3965 [PSH, ACK] Seq=369485957 Ack=1543290807 Win=8908[Malformed Packet] 90:e2:ba:82:2c:7d -> 90:e2:ba:3e:a6:e8
153 2018-02-09 08:58:44.319573    10.10.1.1 -> 10.10.2.1    TCP 80→1401 [ACK] Seq=1 Ack=1 Win=33580 Len=0 90:e2:ba:82:2c:7d -> 90:e2:ba:3e:a6:e8
154 2018-02-09 08:58:44.319657    10.10.2.1 -> 10.10.1.1    TCP 1401→80 [RST] Seq=1 Win=0 Len=0 90:e2:ba:3e:a6:e8 -> 90:e2:ba:82:2c:7d
155 2018-02-09 08:58:44.321075    10.10.1.1 -> 10.10.2.1    TCP [TCP Retransmission] 40875→1214 [PSH, ACK] Seq=1 Ack=1 Win=16968 Len=6 90:e2:ba:82:2c:7d -> 90:e2:ba:3e:a6:e8
156 2018-02-09 08:58:44.322492    10.10.1.1 -> 10.10.2.1    TCP 9941→80 [PSH, ACK] Seq=2199015092 Ack=2621007282 Win=17520[Malformed Packet] 90:e2:ba:82:2c:7d -> 90:e2:ba:3e:a6:e8
157 2018-02-09 08:58:44.323897    10.10.1.1 -> 10.10.2.1    TCP [TCP segment of a reassembled PDU] 90:e2:ba:82:2c:7d -> 90:e2:ba:3e:a6:e8
158 2018-02-09 08:58:44.325416    10.10.1.1 -> 10.10.2.1    TCP [TCP Retransmission] 80→4312 [SYN, ACK] Seq=0 Ack=1 Win=8760 Len=0 MSS=1460 90:e2:ba:82:2c:7d -> 90:e2:ba:3e:a6:e8
159 2018-02-09 08:58:44.325497    10.10.2.1 -> 10.10.1.1    TCP 4312→80 [RST] Seq=1 Win=0 Len=0 90:e2:ba:3e:a6:e8 -> 90:e2:ba:82:2c:7d
160 2018-02-09 08:58:44.326911    10.10.1.1 -> 10.10.2.1    TCP 9941→80 [ACK] Seq=2199015092 Ack=2621007282 Win=17520[Malformed Packet] 90:e2:ba:82:2c:7d -> 90:e2:ba:3e:a6:e8
161 2018-02-09 08:58:44.328294    10.10.1.1 -> 10.10.2.1    TCP 80→1570 [SYN, ACK] Seq=3124942518 Ack=3829827209 Win=17520 MSS=1460 90:e2:ba:82:2c:7d -> 90:e2:ba:3e:a6:e8
162 2018-02-09 08:58:44.329612    10.10.1.1 -> 10.10.2.1    TCP [TCP Retransmission] 80→3016 [ACK] Seq=1 Ack=1 Win=8760 Len=6 90:e2:ba:82:2c:7d -> 90:e2:ba:3e:a6:e8
163 2018-02-09 08:58:44.330916    10.10.1.1 -> 10.10.2.1    ICMP Echo (ping) reply    id=0x564b, seq=62669/52724, ttl=245 90:e2:ba:82:2c:7d -> 90:e2:ba:3e:a6:e8
164 2018-02-09 08:58:44.332382    10.10.1.1 -> 10.10.2.1    TCP [TCP Dup ACK 91#1] 64789→80 [ACK] Seq=1 Ack=1 Win=65340 Len=0 90:e2:ba:82:2c:7d -> 90:e2:ba:3e:a6:e8
165 2018-02-09 08:58:44.332466    10.10.2.1 -> 10.10.1.1    TCP 80→64789 [RST] Seq=1 Win=0 Len=0 90:e2:ba:3e:a6:e8 -> 90:e2:ba:82:2c:7d
166 2018-02-09 08:58:44.333823    10.10.1.1 -> 10.10.2.1    TCP [TCP Retransmission] 10322→1373 [ACK] Seq=1 Ack=1 Win=9898 Len=6 90:e2:ba:82:2c:7d -> 90:e2:ba:3e:a6:e8
167 2018-02-09 08:58:44.335142    10.10.1.1 -> 10.10.2.1    TCP [TCP Retransmission] 10322→1373 [PSH, ACK] Seq=1415 Ack=1 Win=9898 Len=6 90:e2:ba:82:2c:7d -> 90:e2:ba:3e:a6:e8
168 2018-02-09 08:58:44.336503    10.10.1.1 -> 10.10.2.1    TCP [TCP Retransmission] 10322→1373 [PSH, ACK] Seq=2829 Ack=1 Win=9898 Len=6 90:e2:ba:82:2c:7d -> 90:e2:ba:3e:a6:e8
169 2018-02-09 08:58:44.338022    10.10.1.1 -> 10.10.2.1    TCP [TCP Dup ACK 23#4] 2671→8080 [ACK] Seq=1 Ack=1 Win=8760 Len=0 90:e2:ba:82:2c:7d -> 90:e2:ba:3e:a6:e8
170 2018-02-09 08:58:44.338106    10.10.2.1 -> 10.10.1.1    TCP 8080→2671 [RST] Seq=1 Win=0 Len=0 90:e2:ba:3e:a6:e8 -> 90:e2:ba:82:2c:7d
171 2018-02-09 08:58:44.339302    10.10.1.1 -> 10.10.2.1    TCP [TCP Previous segment not captured] [TCP segment of a reassembled PDU] 90:e2:ba:82:2c:7d -> 90:e2:ba:3e:a6:e8
172 2018-02-09 08:58:44.340466    10.10.1.1 -> 10.10.2.1    TCP [TCP Retransmission] 80→41084 [ACK] Seq=1 Ack=1 Win=16126 Len=6 90:e2:ba:82:2c:7d -> 90:e2:ba:3e:a6:e8
173 2018-02-09 08:58:44.341655    10.10.1.1 -> 10.10.2.1    TCP 47302→80 [ACK] Seq=1394080085 Ack=3266262189 Win=17520[Malformed Packet] 90:e2:ba:82:2c:7d -> 90:e2:ba:3e:a6:e8
174 2018-02-09 08:58:44.342785    10.10.1.1 -> 10.10.2.1    TCP [TCP Dup ACK 6#1] 4945→80 [ACK] Seq=1 Ack=1 Win=8760 Len=0 90:e2:ba:82:2c:7d -> 90:e2:ba:3e:a6:e8
175 2018-02-09 08:58:44.342871    10.10.2.1 -> 10.10.1.1    TCP 80→4945 [RST] Seq=1 Win=0 Len=0 90:e2:ba:3e:a6:e8 -> 90:e2:ba:82:2c:7d
176 2018-02-09 08:58:44.343854    10.10.1.1 -> 10.10.2.1    TCP [TCP Dup ACK 8#2] 80→2436 [ACK] Seq=1 Ack=1 Win=8460 Len=0 90:e2:ba:82:2c:7d -> 90:e2:ba:3e:a6:e8
177 2018-02-09 08:58:44.343935    10.10.2.1 -> 10.10.1.1    TCP 2436→80 [RST] Seq=1 Win=0 Len=0 90:e2:ba:3e:a6:e8 -> 90:e2:ba:82:2c:7d
178 2018-02-09 08:58:44.344974    10.10.1.1 -> 10.10.2.1    UDP Source port: 1716  Destination port: 2707 [BAD UDP LENGTH 45 > IP PAYLOAD LENGTH] 90:e2:ba:82:2c:7d -> 90:e2:ba:3e:a6:e8
179 2018-02-09 08:58:44.346278    10.10.1.1 -> 10.10.2.1    TCP 48435→2612 [ACK] Seq=2065075984 Ack=2080017247 Win=63712[Malformed Packet] 90:e2:ba:82:2c:7d -> 90:e2:ba:3e:a6:e8
180 2018-02-09 08:58:44.347350    10.10.1.1 -> 10.10.2.1    UDP Source port: 6003  Destination port: 6003 [BAD UDP LENGTH 122 > IP PAYLOAD LENGTH] 90:e2:ba:82:2c:7d -> 90:e2:ba:3e:a6:e8
181 2018-02-09 08:58:44.348472    10.10.1.1 -> 10.10.2.1    TCP 51253→80 [ACK] Seq=1 Ack=1 Win=32120 Len=0 90:e2:ba:82:2c:7d -> 90:e2:ba:3e:a6:e8
182 2018-02-09 08:58:44.348557    10.10.2.1 -> 10.10.1.1    TCP 80→51253 [RST] Seq=1 Win=0 Len=0 90:e2:ba:3e:a6:e8 -> 90:e2:ba:82:2c:7d
183 2018-02-09 08:58:44.349784    10.10.1.1 -> 10.10.2.1    TCP [TCP Dup ACK 37#1] 1059→80 [ACK] Seq=1 Ack=1 Win=8484 Len=0 90:e2:ba:82:2c:7d -> 90:e2:ba:3e:a6:e8
184 2018-02-09 08:58:44.349870    10.10.2.1 -> 10.10.1.1    TCP 80→1059 [RST] Seq=1 Win=0 Len=0 90:e2:ba:3e:a6:e8 -> 90:e2:ba:82:2c:7d
185 2018-02-09 08:58:44.351133    10.10.1.1 -> 10.10.2.1    TCP 4563→80 [SYN] Seq=1989058321 Win=16384 MSS=1460 90:e2:ba:82:2c:7d -> 90:e2:ba:3e:a6:e8
186 2018-02-09 08:58:44.352246    10.10.1.1 -> 10.10.2.1    TCP 60024→80 [FIN, ACK] Seq=3085108199 Ack=4093544958 Win=17520[Malformed Packet] 90:e2:ba:82:2c:7d -> 90:e2:ba:3e:a6:e8
187 2018-02-09 08:58:44.353301    10.10.1.1 -> 10.10.2.1    TCP [TCP Retransmission] 4656→6699 [PSH, ACK] Seq=1 Ack=1 Win=15557 Len=6 90:e2:ba:82:2c:7d -> 90:e2:ba:3e:a6:e8
188 2018-02-09 08:58:44.354565    10.10.1.1 -> 10.10.2.1    TCP [TCP Retransmission] 80→33670 [PSH, ACK] Seq=1 Ack=1 Win=63832 Len=6 90:e2:ba:82:2c:7d -> 90:e2:ba:3e:a6:e8
189 2018-02-09 08:58:44.355920    10.10.1.1 -> 10.10.2.1    TCP 80→21031 [SYN, ACK] Seq=121525391 Ack=4903925 Win=16384 MSS=1460 90:e2:ba:82:2c:7d -> 90:e2:ba:3e:a6:e8
190 2018-02-09 08:58:44.357167    10.10.1.1 -> 10.10.2.1    TCP 43980→25 [RST] Seq=1 Win=0 Len=0 90:e2:ba:82:2c:7d -> 90:e2:ba:3e:a6:e8
191 2018-02-09 08:58:44.358474    10.10.1.1 -> 10.10.2.1    TCP [TCP Retransmission] 25→3561 [PSH, ACK] Seq=1 Ack=1 Win=17520 Len=6 90:e2:ba:82:2c:7d -> 90:e2:ba:3e:a6:e8
192 2018-02-09 08:58:44.534833    10.10.1.1 -> 10.10.2.1    TCP [TCP Retransmission] 80→46181 [PSH, ACK] Seq=4294965865 Ack=1 Win=31504 Len=6 90:e2:ba:82:2c:7d -> 90:e2:ba:3e:a6:e8
193 2018-02-09 08:58:44.536312    10.10.1.1 -> 10.10.2.1    TCP [TCP Retransmission] 80→1728 [PSH, ACK] Seq=1 Ack=1 Win=32522 Len=6 90:e2:ba:82:2c:7d -> 90:e2:ba:3e:a6:e8
194 2018-02-09 08:58:44.537808    10.10.1.1 -> 10.10.2.1    UDP Source port: 14310  Destination port: 39012 [BAD UDP LENGTH 44 > IP PAYLOAD LENGTH] 90:e2:ba:82:2c:7d -> 90:e2:ba:3e:a6:e8
195 2018-02-09 08:58:44.539474    10.10.1.1 -> 10.10.2.1    TCP [TCP Retransmission] 80→4312 [SYN, ACK] Seq=0 Ack=1 Win=8760 Len=0 MSS=1460 90:e2:ba:82:2c:7d -> 90:e2:ba:3e:a6:e8
196 2018-02-09 08:58:44.539563    10.10.2.1 -> 10.10.1.1    TCP 4312→80 [RST] Seq=1 Win=0 Len=0 90:e2:ba:3e:a6:e8 -> 90:e2:ba:82:2c:7d
197 2018-02-09 08:58:44.541122    10.10.1.1 -> 10.10.2.1    TCP [TCP Retransmission] 80→46181 [PSH, ACK] Seq=1 Ack=1 Win=31504 Len=6 90:e2:ba:82:2c:7d -> 90:e2:ba:3e:a6:e8
198 2018-02-09 08:58:44.542702    10.10.1.1 -> 10.10.2.1    TCP 9949→80 [PSH, ACK] Seq=2201617779 Ack=3464876108 Win=17520[Malformed Packet] 90:e2:ba:82:2c:7d -> 90:e2:ba:3e:a6:e8
199 2018-02-09 08:58:44.544342    10.10.1.1 -> 10.10.2.1    TCP [TCP Retransmission] 80→3016 [ACK] Seq=1 Ack=1 Win=8760 Len=6 90:e2:ba:82:2c:7d -> 90:e2:ba:3e:a6:e8
200 2018-02-09 08:58:44.646448    10.10.1.1 -> 10.10.2.1    TCP [TCP Retransmission] 80→2194 [FIN, ACK] Seq=1 Ack=1 Win=16616 Len=0 90:e2:ba:82:2c:7d -> 90:e2:ba:3e:a6:e8
201 2018-02-09 08:58:44.646564    10.10.2.1 -> 10.10.1.1    TCP 2194→80 [RST] Seq=1 Win=0 Len=0 90:e2:ba:3e:a6:e8 -> 90:e2:ba:82:2c:7d
202 2018-02-09 08:58:44.647952    10.10.1.1 -> 10.10.2.1    TCP 47091→80 [ACK] Seq=2992269940 Ack=4290529155 Win=17520[Malformed Packet] 90:e2:ba:82:2c:7d -> 90:e2:ba:3e:a6:e8
203 2018-02-09 08:58:44.649472    10.10.1.1 -> 10.10.2.1    TCP 80→49365 [PSH, ACK] Seq=3931780319 Ack=3608251601 Win=17135[Malformed Packet] 90:e2:ba:82:2c:7d -> 90:e2:ba:3e:a6:e8
204 2018-02-09 08:58:44.651051    10.10.1.1 -> 10.10.2.1    TCP [TCP Retransmission] 10322→1373 [ACK] Seq=1 Ack=1 Win=9898 Len=6 90:e2:ba:82:2c:7d -> 90:e2:ba:3e:a6:e8
205 2018-02-09 08:58:44.652601    10.10.1.1 -> 10.10.2.1    TCP [TCP Retransmission] 1053→49540 [ACK] Seq=1 Ack=1 Win=8760 Len=6 90:e2:ba:82:2c:7d -> 90:e2:ba:3e:a6:e8
206 2018-02-09 08:58:44.654166    10.10.1.1 -> 10.10.2.1    TCP [TCP Dup ACK 23#5] 2671→8080 [ACK] Seq=1 Ack=1 Win=8760 Len=0 90:e2:ba:82:2c:7d -> 90:e2:ba:3e:a6:e8
207 2018-02-09 08:58:44.654255    10.10.2.1 -> 10.10.1.1    TCP 8080→2671 [RST] Seq=1 Win=0 Len=0 90:e2:ba:3e:a6:e8 -> 90:e2:ba:82:2c:7d
208 2018-02-09 08:58:44.719984    10.10.1.1 -> 10.10.2.1    TCP 1462→80 [ACK] Seq=1 Ack=1 Win=16616 Len=0 90:e2:ba:82:2c:7d -> 90:e2:ba:3e:a6:e8
209 2018-02-09 08:58:44.720084    10.10.2.1 -> 10.10.1.1    TCP 80→1462 [RST] Seq=1 Win=0 Len=0 90:e2:ba:3e:a6:e8 -> 90:e2:ba:82:2c:7d
210 2018-02-09 08:58:44.721793    10.10.1.1 -> 10.10.2.1    TCP [TCP Retransmission] 51253→80 [PSH, ACK] Seq=1 Ack=1 Win=32120 Len=6 90:e2:ba:82:2c:7d -> 90:e2:ba:3e:a6:e8
211 2018-02-09 08:58:44.723368    10.10.1.1 -> 10.10.2.1    TCP [TCP Retransmission] 10646→1469 [PSH, ACK] Seq=1 Ack=1 Win=9660 Len=6 90:e2:ba:82:2c:7d -> 90:e2:ba:3e:a6:e8
212 2018-02-09 08:58:44.724921    10.10.1.1 -> 10.10.2.1    TCP [TCP Dup ACK 8#3] 80→2436 [ACK] Seq=1 Ack=1 Win=8460 Len=0 90:e2:ba:82:2c:7d -> 90:e2:ba:3e:a6:e8
213 2018-02-09 08:58:44.724978    10.10.2.1 -> 10.10.1.1    TCP 2436→80 [RST] Seq=1 Win=0 Len=0 90:e2:ba:3e:a6:e8 -> 90:e2:ba:82:2c:7d
214 2018-02-09 08:58:44.726480    10.10.1.1 -> 10.10.2.1    TCP 8266→80 [FIN, ACK] Seq=1003409482 Ack=2273879807 Win=17520[Malformed Packet] 90:e2:ba:82:2c:7d -> 90:e2:ba:3e:a6:e8
215 2018-02-09 08:58:44.728170    10.10.1.1 -> 10.10.2.1    TCP [TCP Retransmission] 1755→35451 [PSH, ACK] Seq=1461 Ack=1 Win=16224 Len=6 90:e2:ba:82:2c:7d -> 90:e2:ba:3e:a6:e8
216 2018-02-09 08:58:44.729567    10.10.1.1 -> 10.10.2.1    TCP [TCP Retransmission] 1755→35451 [ACK] Seq=1 Ack=1 Win=16224 Len=6 90:e2:ba:82:2c:7d -> 90:e2:ba:3e:a6:e8
217 2018-02-09 08:58:44.737176    10.10.1.1 -> 10.10.2.1    TCP [TCP Dup ACK 10#2] 60024→80 [ACK] Seq=1 Ack=1 Win=8209 Len=0 90:e2:ba:82:2c:7d -> 90:e2:ba:3e:a6:e8
218 2018-02-09 08:58:44.737306    10.10.2.1 -> 10.10.1.1    TCP 80→60024 [RST] Seq=1 Win=0 Len=0 90:e2:ba:3e:a6:e8 -> 90:e2:ba:82:2c:7d
219 2018-02-09 08:58:44.738735    10.10.1.1 -> 10.10.2.1    TCP 51253→80 [ACK] Seq=1 Ack=1 Win=32120 Len=0 90:e2:ba:82:2c:7d -> 90:e2:ba:3e:a6:e8
220 2018-02-09 08:58:44.738834    10.10.2.1 -> 10.10.1.1    TCP 80→51253 [RST] Seq=1 Win=0 Len=0 90:e2:ba:3e:a6:e8 -> 90:e2:ba:82:2c:7d
221 2018-02-09 08:58:44.740332    10.10.1.1 -> 10.10.2.1    TCP 3988→80 [ACK] Seq=1 Ack=1 Win=8760 Len=0 90:e2:ba:82:2c:7d -> 90:e2:ba:3e:a6:e8
222 2018-02-09 08:58:44.740443    10.10.2.1 -> 10.10.1.1    TCP 80→3988 [RST] Seq=1 Win=0 Len=0 90:e2:ba:3e:a6:e8 -> 90:e2:ba:82:2c:7d
223 2018-02-09 08:58:44.741787    10.10.1.1 -> 10.10.2.1    TCP [TCP Retransmission] 1755→3539 [PSH, ACK] Seq=1 Ack=1 Win=16080 Len=6 90:e2:ba:82:2c:7d -> 90:e2:ba:3e:a6:e8
224 2018-02-09 08:58:44.743264    10.10.1.1 -> 10.10.2.1    TCP [TCP Dup ACK 112#2] 4662→65158 [ACK] Seq=1 Ack=1 Win=64635 Len=0 90:e2:ba:82:2c:7d -> 90:e2:ba:3e:a6:e8
225 2018-02-09 08:58:44.743375    10.10.2.1 -> 10.10.1.1    TCP 65158→4662 [RST] Seq=1 Win=0 Len=0 90:e2:ba:3e:a6:e8 -> 90:e2:ba:82:2c:7d
226 2018-02-09 08:58:44.744797    10.10.1.1 -> 10.10.2.1    TCP [TCP Retransmission] 4656→6699 [PSH, ACK] Seq=1 Ack=1 Win=15557 Len=6 90:e2:ba:82:2c:7d -> 90:e2:ba:3e:a6:e8
227 2018-02-09 08:58:44.746195    10.10.1.1 -> 10.10.2.1    TCP [TCP segment of a reassembled PDU] 90:e2:ba:82:2c:7d -> 90:e2:ba:3e:a6:e8
228 2018-02-09 08:58:44.788731    10.10.1.1 -> 10.10.2.1    TCP 80→21031 [SYN, ACK] Seq=121525391 Ack=4903925 Win=16384 MSS=1460 90:e2:ba:82:2c:7d -> 90:e2:ba:3e:a6:e8
229 2018-02-09 08:58:44.790153    10.10.1.1 -> 10.10.2.1    TCP 43980→25 [RST] Seq=1 Win=0 Len=0 90:e2:ba:82:2c:7d -> 90:e2:ba:3e:a6:e8
230 2018-02-09 08:58:44.791540    10.10.1.1 -> 10.10.2.1    TCP [TCP Retransmission] 25→3561 [PSH, ACK] Seq=1 Ack=1 Win=17520 Len=6 90:e2:ba:82:2c:7d -> 90:e2:ba:3e:a6:e8
231 2018-02-09 08:58:44.793000    10.10.1.1 -> 10.10.2.1    TCP [TCP Retransmission] 80→46181 [PSH, ACK] Seq=4294965865 Ack=1 Win=31504 Len=6 90:e2:ba:82:2c:7d -> 90:e2:ba:3e:a6:e8
232 2018-02-09 08:58:44.794584    10.10.1.1 -> 10.10.2.1    TCP [TCP Retransmission] 80→1728 [PSH, ACK] Seq=1 Ack=1 Win=32522 Len=6 90:e2:ba:82:2c:7d -> 90:e2:ba:3e:a6:e8
233 2018-02-09 08:58:44.796140    10.10.1.1 -> 10.10.2.1    TCP [TCP Retransmission] 8478→63476 [PSH, ACK] Seq=1 Ack=1 Win=8760 Len=6 90:e2:ba:82:2c:7d -> 90:e2:ba:3e:a6:e8
234 2018-02-09 08:58:44.812480    10.10.1.1 -> 10.10.2.1    TCP [TCP Dup ACK 85#1] 30737→80 [ACK] Seq=1 Ack=1 Win=64240 Len=0 90:e2:ba:82:2c:7d -> 90:e2:ba:3e:a6:e8
235 2018-02-09 08:58:44.812612    10.10.2.1 -> 10.10.1.1    TCP 80→30737 [RST] Seq=1 Win=0 Len=0 90:e2:ba:3e:a6:e8 -> 90:e2:ba:82:2c:7d
236 2018-02-09 08:58:44.814082    10.10.1.1 -> 10.10.2.1    TCP [TCP segment of a reassembled PDU] 90:e2:ba:82:2c:7d -> 90:e2:ba:3e:a6:e8
237 2018-02-09 08:58:44.815628    10.10.1.1 -> 10.10.2.1    TCP 9949→80 [PSH, ACK] Seq=2201617779 Ack=3464876108 Win=17520[Malformed Packet] 90:e2:ba:82:2c:7d -> 90:e2:ba:3e:a6:e8
238 2018-02-09 08:58:44.817220    10.10.1.1 -> 10.10.2.1    TCP [TCP Retransmission] 80→3016 [ACK] Seq=1 Ack=1 Win=8760 Len=6 90:e2:ba:82:2c:7d -> 90:e2:ba:3e:a6:e8
239 2018-02-09 08:58:44.818851    10.10.1.1 -> 10.10.2.1    TCP [TCP Retransmission] 80→46181 [PSH, ACK] Seq=1433 Ack=1 Win=31504 Len=6 90:e2:ba:82:2c:7d -> 90:e2:ba:3e:a6:e8
240 2018-02-09 08:58:44.820305    10.10.1.1 -> 10.10.2.1    TCP [TCP Retransmission] 80→2194 [FIN, ACK] Seq=1 Ack=1 Win=16616 Len=0 90:e2:ba:82:2c:7d -> 90:e2:ba:3e:a6:e8
241 2018-02-09 08:58:44.820434    10.10.2.1 -> 10.10.1.1    TCP 2194→80 [RST] Seq=1 Win=0 Len=0 90:e2:ba:3e:a6:e8 -> 90:e2:ba:82:2c:7d
242 2018-02-09 08:58:44.821835    10.10.1.1 -> 10.10.2.1    TCP [TCP Retransmission] 10322→1373 [PSH, ACK] Seq=2829 Ack=1 Win=9898 Len=6 90:e2:ba:82:2c:7d -> 90:e2:ba:3e:a6:e8
243 2018-02-09 08:58:44.830961    10.10.1.1 -> 10.10.2.1    TCP 12797→80 [FIN, ACK] Seq=252259445 Ack=3656396957 Win=33304[Malformed Packet] 90:e2:ba:82:2c:7d -> 90:e2:ba:3e:a6:e8
244 2018-02-09 08:58:44.832608    10.10.1.1 -> 10.10.2.1    TCP [TCP Dup ACK 208#1] 1462→80 [ACK] Seq=1 Ack=1 Win=16616 Len=0 90:e2:ba:82:2c:7d -> 90:e2:ba:3e:a6:e8
245 2018-02-09 08:58:44.832700    10.10.2.1 -> 10.10.1.1    TCP 80→1462 [RST] Seq=1 Win=0 Len=0 90:e2:ba:3e:a6:e8 -> 90:e2:ba:82:2c:7d
246 2018-02-09 08:58:44.834192    10.10.1.1 -> 10.10.2.1    TCP [TCP Retransmission] 80→41084 [ACK] Seq=1 Ack=1 Win=16126 Len=6 90:e2:ba:82:2c:7d -> 90:e2:ba:3e:a6:e8
247 2018-02-09 08:58:44.835739    10.10.1.1 -> 10.10.2.1    TCP 47302→80 [ACK] Seq=1394080085 Ack=3266262189 Win=17520[Malformed Packet] 90:e2:ba:82:2c:7d -> 90:e2:ba:3e:a6:e8
248 2018-02-09 08:58:44.837291    10.10.1.1 -> 10.10.2.1    TCP [TCP Dup ACK 8#4] 80→2436 [ACK] Seq=1 Ack=1 Win=8460 Len=0 90:e2:ba:82:2c:7d -> 90:e2:ba:3e:a6:e8
249 2018-02-09 08:58:44.837397    10.10.2.1 -> 10.10.1.1    TCP 2436→80 [RST] Seq=1 Win=0 Len=0 90:e2:ba:3e:a6:e8 -> 90:e2:ba:82:2c:7d
250 2018-02-09 08:58:44.838855    10.10.1.1 -> 10.10.2.1    TCP 5762→80 [SYN] Seq=1851051921 Win=65535 MSS=1460 90:e2:ba:82:2c:7d -> 90:e2:ba:3e:a6:e8
